,Poet_Name,Couplet,Interpretation
99,غلام محمد قاصر,"کروں_گا کیا جو محبت میں ہو گیا ناکام
مجھے تو اور کوئی کام بھی نہیں آتا",یہ شعر ایک عاشق کی بے بسی اور ناکامی کا احساس کو بیان کرتا ہے۔ جب عاشق اپنی محبت میں ناکام ہو جاتا ہے، تو وہ ایسا محسوس کرتا ہے کہ اس کے پاس کوئی دوسرا کام بھی نہیں ہے۔ یہ شعر محبت کی اہمیت اور اس کی ناکامی کے اثرات کو بیان کرتا ہے، جس سے عاشق کی زندگی خالی اور بے معنی نظر آتی ہے۔ اس میں عاشق کی بے چینی اور دل کی تڑپ کا احساس بھی شامل ہے۔
100,جمیل ملک,"ہم سے کوئی تعلق_خاطر تو ہے اسے
وہ یار با_وفا نہ سہی بے_وفا تو ہے",اس شعر میں شاعر نے اپنے دل کی تلخی اور بے یقینی کا اظہار کیا ہے۔ ظاہری مطلب یہ ہے کہ شاعر کسی شخص سے تعلق رکھتا ہے، لیکن وہ شخص باوفا نہیں ہے، بلکہ بے وفا ہے۔ اس شعر کے بنیادی تشریح میں، شاعر کی بے یقینی اور دل کی کشمکش کا احساس شامل ہے۔ شاعر کسی ایسے شخص سے تعلق رکھتا ہے جو اس کے لیے محبت کا اظہار کرتا ہے، لیکن اس محبت میں بے وفائی کا عنصر بھی موجود ہے۔ یہ شعر انسانی تعلقات میں بے یقینی کی عکاسی کرتا ہے جس میں دل کی تلخی اور افسوس شامل ہے۔
101,وسیم بریلوی,"تجھے پانے کی کوشش میں کچھ اتنا کھو چکا ہوں میں
کہ تو مل بھی اگر جائے تو اب ملنے کا غم ہوگا","اس شعر کا ظاہری مطلب یہ ہے کہ محبوب کو پانے کی کوشش میں شخص نے اتنا کچھ کھو دیا ہے کہ اگر محبوب مل بھی جائے تو بھی اس ملنے سے محض غم ہی ہوگا۔

بنیادی تشریح میں، اس شعر کے اہم تصورات میں عشق کی کوشش، نقصان اور ملنے کا غم شامل ہیں۔ شاعر کا مقصد یہ بیان کرنا ہے کہ عشق میں اتنا کچھ کھونا پڑتا ہے کہ جب محبوب مل جاتا ہے تو بھی خوشی کی بجائے غم کی جھلکیاں نظر آتی ہیں۔ اس شعر میں ""کوشش""، ""کھونا"" اور ""غم"" کلیدی الفاظ ہیں جو عشق کی انتہائی حد تک پہنچنے کے نتیجے میں ہونے والے نقصان کو بیان کرتے ہیں۔"
102,سیماب اکبرآبادی,"عمر_دراز مانگ کے لائی تھی چار دن
دو آرزو میں کٹ گئے دو انتظار میں",اس شعر میں شاعر نے زندگی کی عمر کی قدر اور اس میں گزرنے والے وقت کے استعمال کی اہمیت کو بیان کیا ہے۔ شاعر کہتا ہے کہ وہ ایک طویل عمر مانگ کر لایا تھا، مگر اس عمر کے چار دن ہی رہائش تھے۔ دو دن آرزو کی تکمیل میں گذرے اور دو دن انتظار کی صورت میں۔ اس طرح، شاعر نے زندگی کی عمر کی نازکیت اور اس میں گزرنے والے وقت کی قیمت کو بیان کیا ہے، جو عمر کی مختصریت اور اس میں گزرنے والے وقت کی اہمیت کو روشن کرتا ہے۔
103,مرزا غالب,"عشرت_قطرہ ہے دریا میں فنا ہو جانا
درد کا حد سے گزرنا ہے دوا ہو جانا","یہ شعر انسانی زندگی کی عمدہ خوبیوں اور مشکلات کو بیان کرتا ہے۔ ""عشرت قطرہ ہے دریا میں فنا ہو جانا"" میں، عشرت (خوشی) کو دریا میں فنا ہونے والا قطرہ کہا گیا ہے، جس سے مراد یہ ہے کہ خوشی کے لمحات مختصر ہوتے ہیں اور زندگی کے بڑے سلسلے میں گم ہو جاتے ہیں۔ ""درد کا حد سے گزرنا ہے دوا ہو جانا"" میں، درد کے ساتھ گزرنا اور اس سے نمٹنا انسانی زندگی کا حقیقی معنی بنتا ہے۔ یہ شعر ظاہر کرتا ہے کہ مشکلات سے نبھنا اور ان سے سبق لینا انسانی زندگی کی اہم صفت ہے۔"
104,بشیر بدر,"مسافر ہیں ہم بھی مسافر ہو تم بھی
کسی موڑ پر پھر ملاقات ہوگی","اس شعر میں شاعر نے زندگی کی عبوریت اور سفر کے تصور کو اجاگر کیا ہے۔ شعر کے مطلب کے لحاظ سے، ہم سب ایک دوسرے سے ملتے ہیں اور جدا ہوتے ہیں، لیکن زندگی کے سفر میں کسی نئے موڑ پر دوبارہ ملاقات ہو سکتی ہے۔ یہاں ""مسافر"" کا مطلب زندگی کا سفر کرنے والا شخص ہے، جبکہ ""موڑ"" زندگی کے راستے کا ایک موڑ یا نئی منزل کی علامت ہے۔ اس طرح، یہ شعر ہمیں یہ یاد دلاتا ہے کہ زندگی میں ہمیں کئی موڑ اور منزلیں ملتی ہیں، اور ہمیں کسی نئے موڑ پر دوبارہ ملاقات کی امید رہتی ہے۔"
105,احمد فراز,"زندگی سے یہی گلہ ہے مجھے
تو بہت دیر سے ملا ہے مجھے",اس شعر میں شاعر زندگی کے حوالے سے اپنی شکایت کا اظہار کرتا ہے۔ ظاہری مطلب یہ ہے کہ شاعر کو زندگی سے ایک شکایت ہے، جو یہ ہے کہ زندگی نے بہت دیر سے اسے سمجھ لیا ہے۔ اس شعر میں مرکزی تصورات میں شکایت، زندگی اور وقت شامل ہیں۔ شاعر اپنی زندگی میں جو کچھ ہوا ہے، اس کے بارے میں سوچتا ہے اور اس بات کا احساس کرتا ہے کہ زندگی نے اسے بہت دیر سے سمجھا ہے، ممکنہ طور پر اس کے تجربات اور سوچ کے تناظر میں۔
106,جون ایلیا,"علاج یہ ہے کہ مجبور کر دیا جاؤں
وگرنہ یوں تو کسی کی نہیں سنی میں نے",اس شعر میں، شاعر اپنی ذات کی علاج و مداوا کے لیے مجبوری کی اہمیت پر روشنی ڈالتا ہے۔ شاعر کا کہنا ہے کہ اگر مجبور نہ کیا جاتا تو وہ کبھی بہتری کی طرف نہیں گامزن ہوتا۔ اس کے علاوہ، شاعر اپنی ناکامیوں اور اپنی خود کی سماعت کی کمی کا اظہار کرتا ہے۔ یہ شعر انسانی طبیعت کی کمزوریوں اور اس کے بہتری کے لیے مجبوری کی ضرورت کا احساس دلاتا ہے۔ شاعر کے اندرونی جدوجہد اور اس کی بہتری کے لیے مجبوری کی اہمیت کا اظہار شعر کا مرکزی تصور ہے۔
107,بشیر بدر,"ہر دھڑکتے پتھر کو لوگ دل سمجھتے ہیں
عمریں بیت جاتی ہیں دل کو دل بنانے میں",اس شعر کا ظاہری مطلب یہ ہے کہ لوگ کسی بھی دھڑکتے چیز کو دل سمجھ لیتے ہیں، حالانکہ دل کو دل بنانے میں عمریں بیت جاتی ہیں۔ بنیادی تشریح یہ ہے کہ انسانی زندگی میں اصل دل کو پہچاننا اور وہ دل بنانا بہت مشکل ہوتا ہے۔ لوگ آسانی سے کسی بھی دھڑکتی چیز کو دل سمجھ لیتے ہیں، جبکہ اصل دل بنانے کے لیے زندگی کی عمریں صرف ہو جاتی ہیں۔ یہ شعر انسانی نفسیات اور زندگی کی پیچیدگیوں کو بیان کرتا ہے۔
108,ساحر لدھیانوی,"دیکھا ہے زندگی کو کچھ اتنے قریب سے
چہرے تمام لگنے لگے ہیں عجیب سے","یہ شعر زندگی کی حقیقت اور اس کے پیچیدہ پہلوؤں کی عکاسی کرتا ہے۔ شاعر نے زندگی کو اتنے قریب سے دیکھنے کے بعد اس کے مختلف رخوں کو سمجھنے کی کوشش کی ہے۔ ""دیکھا ہے زندگی کو کچھ اتنے قریب سے"" کا مطلب ہے کہ شاعر نے زندگی کے بارے میں گہری سمجھ حاصل کی ہے۔ ""چہرے تمام لگنے لگے ہیں عجیب سے"" کا مطلب ہے کہ زندگی کے پیچیدہ اور غیر معمولی پہلوؤں کو سمجھنے کے بعد، شاعر کو زندگی کے الٹے پہلو بھی نظر آنے لگے ہیں۔ یہ شعر زندگی کی پیچیدگی اور اس کے مختلف رخوں کی عکاسی کرتا ہے۔"
109,راحت اندوری,"دوستی جب کسی سے کی جائے
دشمنوں کی بھی رائے لی جائے","اس شعر کا ظاہری مطلب یہ ہے کہ جب کسی سے دوستی کی جائے تو اس سے قبل دشمنوں کی رائے بھی لی جائے، یعنی دوستی کرتے وقت دشمنوں کے نقطہ نظر کا بھی خیال رکھا جائے۔

بنیادی تشریح میں، یہ شعر انسانی تعلقات اور دوستی کی حقیقت کو بیان کرتا ہے۔ یہ ظاہر کرتا ہے کہ دوستی سے پہلے دشمنوں کی رائے لینا چاہیے تاکہ دوستی کے نتائج کا اندازہ ہو سکے۔ اس سے مراد یہ ہے کہ ہر فیصلے میں مختلف نقطہ نظر کا خیال رکھنا ضروری ہے، خاص طور پر ان لوگوں کا جن کی رائے سے ہمیں نفع ہو سکتا ہے۔ اس طرح، دوستی کے فیصلے میں دشمنوں کی رائے لینا ایک حکمت کا اظہار ہے۔"
110,بشیر بدر,"خدا کی اتنی بڑی کائنات میں میں نے
بس ایک شخص کو مانگا مجھے وہی نہ ملا",اس شعر میں شاعر نے خدا کی وسیع کائنات کا تذکرہ کیا ہے جس میں بے شمار افراد اور چیزیں شامل ہیں۔ شاعر کا مطلب یہ ہے کہ اس بہت بڑی کائنات میں جہاں ہر چیز دستیاب ہے، اس نے صرف ایک شخص کو مانگا تھا۔ لیکن اس کی خواہش پوری نہیں ہوئی اور وہ شخص اسے نہیں مل سکا۔ یہ شعر عام طور پر عشق کی بے بسی اور بے یاری کا اظہار کرتا ہے، جہاں شاعر اپنے محبوب کی غیر موجودگی کا درد بیان کرتا ہے۔
111,جون ایلیا,"ہم کو یاروں نے یاد بھی نہ رکھا
جونؔ یاروں کے یار تھے ہم تو","اس شعر میں، شاعر اپنی دل کی بے یاری اور دل آزاری کا اظہار کرتا ہے۔ ظاہری مطلب یہ ہے کہ شاعر کے دوست اسے یاد نہیں رکھتے، حالانکہ شاعر خود ان کا بہترین دوست تھا۔ بنیادی تشریح یہ ہے کہ شاعر نے اپنے دوستوں کی بے وفائی اور ناشکری کا احساس دلایا ہے۔ اس میں ""یاروں نے یاد بھی نہ رکھا"" کا مطلب ہے کہ دوست نے شاعر کو یاد نہیں رکھا، جبکہ ""یاروں کے یار تھے ہم تو"" کا مطلب ہے کہ شاعر خود ان دوستوں کا بہترین دوست تھا۔ اس شعر میں شاعر نے اپنی بے یاری اور دل آزاری کا اظہار کیا ہے۔"
112,جلیل مانک پوری,"آپ پہلو میں جو بیٹھیں تو سنبھل کر بیٹھیں
دل_بیتاب کو عادت ہے مچل جانے کی","اس شعر میں شاعر نے دل کی بیتابی اور اس کی احساسات کی نازکی کو بیان کیا ہے۔ شاعر کہتا ہے کہ اگر آپ دل کے قریب بیٹھیں تو احتیاط سے بیٹھیں، کیونکہ دل بیتاب بہت حساس ہوتا ہے اور اس میں مچلنے کی عادت ہوتی ہے۔ یہاں ""مچلنے کی عادت"" سے مراد دل کی بے چینی اور بے قراری ہے جو کسی بھی چھوٹی سی بات پر پیدا ہو سکتی ہے۔ اس شعر میں دل کی حساسیت اور اس کی ردعمل کی تیزی کو بہت خوبی سے بیان کیا گیا ہے۔"
113,مرزا غالب,"ہم کو ان سے وفا کی ہے امید
جو نہیں جانتے وفا کیا ہے",اس شعر میں شاعر کا بنیادی موضوع وفا اور امید ہے۔ شاعر کہتا ہے کہ ہم ان لوگوں سے وفا کی امید رکھتے ہیں جو وفا کے معنی سے بے خبر ہیں۔ یہ شعر انسانی فطرت کی ایک اہم پہلو کو اجاگر کرتا ہے جہاں انسان اپنے آپ سے ناواقف لوگوں سے بھی وفا کی امید رکھتا ہے۔ اس کے پیچھے یہ فلسفہ ہے کہ انسان ہمیشہ اپنے ایمانداری اور لگن کی امید میں رہتا ہے، چاہے دوسروں کو اس کا احساس ہو یا نہیں۔ اس شعر کا عملی مطلب یہ بھی ہو سکتا ہے کہ کبھی کبھی ہم ان لوگوں سے بھی وفا کی امید رکھتے ہیں جو ہماری قدر و قیمت سمجھنے سے قاصر ہیں۔
114,نظام رامپوری,"انداز اپنا دیکھتے ہیں آئنے میں وہ
اور یہ بھی دیکھتے ہیں کوئی دیکھتا نہ ہو",اس شعر میں شاعر انداز (طرز عمل) کی اہمیت کو بیان کرتا ہے۔ انداز کوئی بھی انسان کے ملبوسات، طرز گفتگو یا رویے کا طریقہ ہو سکتا ہے۔ شاعر کہتا ہے کہ وہ لوگ اپنے انداز کو آئنے میں دیکھتے ہیں، یعنی وہ اپنے طرز عمل پر غور کرتے ہیں۔ اس کے علاوہ، وہ یہ بھی دیکھتے ہیں کہ کوئی اور ان پر نظر نہ رکھے، یعنی وہ اپنے آپ کو دوسروں کی نگاہوں سے بچانے کی کوشش کرتے ہیں۔ اس طرح، یہ شعر ایک مرکزی نکتہ پیش کرتا ہے کہ لوگ اپنے انداز پر غور کرتے ہوئے اپنی نجی زندگی کی حفاظت بھی کرتے ہیں۔
115,مرزا غالب,"وہ آئے گھر میں ہمارے خدا کی قدرت ہے
کبھی ہم ان کو کبھی اپنے گھر کو دیکھتے ہیں","اس شعر کا ظاہری مطلب یہ ہے کہ جب کوئی محبوب شخص ہمارے گھر میں آتا ہے تو ہمارے لیے یہ بہت بڑی بات ہوتی ہے، جیسے خدا کی قدرت کا کرشمہ ہو۔ ہم اس شخص کو دیکھتے ہیں اور اس کی وجہ سے ہمارے گھر کی اہمیت بھی بڑھ جاتی ہے۔

بنیادی تشریح میں، اس شعر کے تین اہم تصورات ہیں: محبوب کی آمد، خدا کی قدرت، اور گھر کی اہمیت۔ یہ شعر انسانی جذبات کی ترجمانی کرتا ہے، جہاں محبوب کی آمد کو خدا کی قدرت کے برابر سمجھا جاتا ہے، جو ہمارے گھر کی اہمیت کو اور بڑھاتا ہے۔ یہ شعر انسانی رشتوں کی اہمیت اور ان کے تعلقات کی قدرت کو بیان کرتا ہے۔"
116,کیفی اعظمی,"بس اک جھجک ہے یہی حال_دل سنانے میں
کہ تیرا ذکر بھی آئے_گا اس فسانے میں","اس شعر میں شاعر اپنے دل کی کیفیت کا اظہار کرتا ہے۔ شاعر کہتا ہے کہ اس کے دل کو اپنی کیفیت بیان کرنے میں ایک جھجک یا ہچکچاہٹ ہے۔ یہ جھجک اس لیے ہے کیونکہ وہ چاہتا ہے کہ اس کی دل کی بات سنانے میں تیرا ذکر بھی آئے۔ اس طرح، شاعر اپنی محبت کا اظہار کرتا ہے اور یہ بتاتا ہے کہ اس کے دل کی بات میں اس کی محبوب کا ذکر ضروری ہے۔ شعر میں ""جھجک""، ""دل سنانے میں""، ""تیرا ذکر"" اور ""اس فسانے میں"" کلیدی الفاظ ہیں جو شاعر کی کیفیت اور محبت کی عکاسی کرتے ہیں۔"
117,ناصر کاظمی,"آج دیکھا ہے تجھ کو دیر کے بعد
آج کا دن گزر نہ جائے کہیں","اس شعر میں شاعر اپنے دل میں توقعات کا اظہار کرتا ہے۔ ظاہری مطلب یہ ہے کہ شاعر نے اپنے محبوب کو کافی عرصے بعد دیکھا ہے اور وہ چاہتا ہے کہ آج کا دن ختم نہ ہو جائے، تاکہ اس کا ملنا جلنا جاری رہے۔

بنیادی تشریح یہ ہے کہ شاعر اپنے محبوب کے ساتھ ملنے کی خوشی اور اس لمحے کو ختم نہ ہونے کی دعا کر رہا ہے۔ یہ شعر عشق کی بے قراری اور دوری کی تکلیف کا احساس دلاتا ہے۔ شاعر کے لیے، اس ملاقات کا لمحہ بہت قیمتی ہے اور وہ نہیں چاہتا کہ یہ لمحہ ختم ہو جائے۔ یہ شعر عشق، توقعات اور خوشی کے احساس کو بیان کرتا ہے۔"
118,فرحت احساس,"اک رات وہ گیا تھا جہاں بات روک کے
اب تک رکا ہوا ہوں وہیں رات روک کے","اس شعر میں شاعر نے اپنی محبت کی یادوں اور انتظار کا احساس بیان کیا ہے۔ شعر کا ظاہری مطلب یہ ہے کہ شاعر کوئی ایک خاص رات یاد کر رہا ہے جب اس کی محبوبہ چلی گئی تھی اور اس کے بعد سے وہ وہیں رات روک کے انتظار کر رہا ہے۔

بنیادی تشریح: شاعر نے اس شعر میں اپنی محبت کی یادوں کو روکے ہوئے بیان کیا ہے۔ ""وہ گیا تھا"" سے مراد محبوبہ کا جانا ہے جبکہ ""بات روک کے"" سے مراد اس وقت کا دور ہے جب بات چیت رک گئی تھی۔ ""اب تک رکا ہوا ہوں"" سے مراد شاعر کا انتظار کرنا ہے جو اس وقت سے لے کر اب تک جاری ہے۔ ""وہیں رات روک کے"" سے مراد شاعر کا رات کو روک کر انتظار کرنا ہے۔ اس کے ذریعے شاعر نے اپنے انتظار اور یادوں کی تکلیف کو بیان کیا ہے۔"
119,مرزا غالب,"نہ تھا کچھ تو خدا تھا کچھ نہ ہوتا تو خدا ہوتا
ڈبویا مجھ کو ہونے نے نہ ہوتا میں تو کیا ہوتا","اس شعر میں شاعر نے زندگی اور وجود کے اہم فلسفیانہ تصورات کو بیان کیا ہے۔ شعر کا ظاہری مطلب یہ ہے کہ اگر کچھ نہ ہوتا تو خدا تھا، اور اگر خدا نہ ہوتا تو کچھ بھی نہ ہوتا۔ اس کے بعد شاعر یہ بیان کرتا ہے کہ وجود میں آنے نے اسے ڈبویا، اور اگر وجود میں نہ آتا تو اس کا کیا ہوتا؟

بنیادی تشریح میں، شاعر نے خدا اور وجود کے درمیان تعلق کو بیان کیا ہے۔ شاعر یہ بیان کرتا ہے کہ خدا کی وجہ سے ہی کچھ بھی ہے اور اگر خدا نہ ہوتا تو کچھ بھی نہ ہوتا۔ اس کے بعد شاعر اپنے وجود کے بارے میں سوال اٹھاتا ہے کہ اگر وہ وجود میں نہ آتا تو اس کا کیا ہوتا؟ یہ شعر انسانی وجود کی بے بسی اور انسان کے وجود کے فلسفیانہ مسائل کو بیان کرتا ہے۔"
120,باقی صدیقی,"تم زمانے کی راہ سے آئے
ورنہ سیدھا تھا راستہ دل کا","اس شعر میں شاعر اردو زمانے کی راہ سے آنے والے کو خطاب کرتے ہوئے کہتا ہے کہ اگر تم زمانے کے تقاضوں اور راہوں سے نہ آتے تو دل کا راستہ سیدھا اور آسان ہوتا۔ یہاں ""زمانہ"" سے مراد دنیا کی روایات، سماجی ضروریات اور رسومات ہیں جو انسان کو اپنے اصل اور خالص احساسات سے دور کر دیتی ہیں۔ شاعر یہاں ایک بنیادی فلسفہ بیان کرتا ہے کہ انسان کا دل اصل میں پاک اور سیدھا ہوتا ہے، مگر زمانے کی وجہ سے اس میں تبدیلی آجاتی ہے۔

اہم تصورات میں ""زمانہ""، ""راہ"" اور ""دل"" شامل ہیں۔ ""زمانہ"" سماجی اور ثقافتی پابندیوں کی علامت ہے، ""راہ"" سے مراد ترقی اور تبدیلی کا عمل ہے، اور ""دل"" انسانی احساسات اور خالص ذہنیت کی نمائندگی کرتا ہے۔ شاعر کا مقصد یہ ہے کہ انسان اپنے اصل احساسات اور ذہنیت کو برقرار رکھے، بجائے اس کے کہ وہ زمانے کی روایات اور ضروریات کے تحت اپنے آپ کو تبدیل کر لے۔"
121,بشیر بدر,"تم محبت کو کھیل کہتے ہو
ہم نے برباد زندگی کر لی","اس شعر کا ظاہری مطلب یہ ہے کہ شخص جسے تم ""محبت"" کو کھیل سمجھتے ہو، ہم نے اس محبت میں اپنی زندگی تباہ کر لی ہے۔ بنیادی تشریح میں اہم تصورات یہ ہیں کہ محبت کو کھیل سمجھنا ایک غلط نظریہ ہے کیونکہ محبت میں لوگ اپنی زندگی داں کر دیتے ہیں۔ اس شعر میں درد اور ندامت کا اظہار ہے جو محبت میں ناکامی کی وجہ سے ہوتا ہے۔ کلیدی نکات یہ ہیں کہ محبت میں ایک فرد کی زندگی کیسے تباہ ہو سکتی ہے اور کس طرح تم جیسے لوگ محبت کو کھیل سمجھتے ہیں جبکہ ہم نے اس میں اپنی زندگی داں کر دی ہے۔"
122,کرشن بہاری نور,"میں تو غزل سنا کے اکیلا کھڑا رہا
سب اپنے اپنے چاہنے والوں میں کھو گئے","اس شعر کا ظاہری مطلب یہ ہے کہ شاعر غزل سن کر اکیلا کھڑا رہ گیا ہے، جبکہ دوسرے لوگ اپنے اپنے چاہنے والوں میں کھو گئے ہیں۔

بنیادی تشریح یہ ہے کہ شاعر نے غزل سننے کے بعد اپنی تنہائی کا احساس کیا ہے۔ یہ شعر عشق و محبت کے تصور کو پیش کرتا ہے، جہاں دوسرے لوگ اپنے محبوبوں میں گم ہو گئے ہیں، جبکہ شاعر اکیلا رہ گیا ہے۔ یہ تنہائی کا احساس غزل کے جذبے کی وجہ سے ہے۔ اس شعر میں اکیلاپن اور غزل کی تاثیر کے تصورات کا احاطہ کیا گیا ہے۔"
123,فراق گورکھپوری,"ہم سے کیا ہو سکا محبت میں
خیر تم نے تو بے_وفائی کی","اس شعر میں شاعر اپنی محبت میں ناکامی کا اعتراف کرتے ہوئے اپنے محبوب کو ملامت کر رہا ہے۔ ظاہری مطلب یہ ہے کہ شاعر کہتا ہے کہ ہم نے محبت میں کوئی کمی نہیں کی، لیکن آپ نے بے وفائی کی ہے۔

بنیادی تشریح میں، شاعر اپنی وفاداری اور پیار کا اظہار کرتے ہوئے اپنے محبوب کی بے وفائی پر افسوس کا اظہار کرتا ہے۔ یہاں اہم تصورات محبت، وفاداری اور بے وفائی ہیں۔ شاعر اپنی بے بسی اور دل کی شکست کا احساس دلاتا ہے کہ اس کے سارے احساسات کیسے ایک بے وفا محبوب کی روشنی میں خاک میں مل گئے۔"
124,جون ایلیا,"اس گلی نے یہ سن کے صبر کیا
جانے والے یہاں کے تھے ہی نہیں",اس شعر میں شاعر نے ایک گلی کو ایسے لوگوں کی یاد میں پیش کیا ہے جو اب یہاں موجود نہیں ہیں۔ گلی نے ان لوگوں کے جانے کے بعد صبر کیا، جو ایک اندازے کے طور پر ان لوگوں کی غیر موجودگی کا احساس ہے۔ اس شعر میں صبر، جانے والے اور گلی جیسے تصورات اہم ہیں، جو زندگی کی عبوری نوعیت اور انسانی تعلقات کی ہلکی پن کی عکاسی کرتے ہیں۔
