,Poet_Name,Couplet,Interpretation
0,بشیر بدر,"اجالے اپنی یادوں کے ہمارے ساتھ رہنے دو
نہ جانے کس گلی میں زندگی کی شام ہو جائے","یہ شعر شاعر کے دل کی گہرائیوں سے نکلنے والی جذباتی اظہار ہے۔ ظاہری مطلب یہ ہے کہ شاعر اپنی یادوں کو اپنے ساتھ رکھنے کی خواہش رکھتا ہے، چاہے زندگی کی شام کسی بھی گلی میں ہو۔ بنیادی تشریح میں، شاعر کی یادوں کو ایک قیمتی سرمایہ کے طور پر پیش کیا گیا ہے جسے وہ ہرگز بھولنا نہیں چاہتا۔ ""اجالے"" اور ""یادوں"" سے مراد شاعر کے گذرے ہوئے وقت کے خوش اور غم کے لمحات ہیں۔ ""زندگی کی شام"" سے مراد زندگی کے اختتام کی طرف روانگی ہے، جو کسی بھی گلی میں ہو سکتی ہے۔ شاعر ان یادوں کو اپنے ساتھ رکھنے کی خواہش رکھتا ہے تاکہ وہ ان کی مدد سے زندگی کی تلخیوں کو برداشت کر سکے۔"
1,فیض احمد فیض,"اور بھی دکھ ہیں زمانے میں محبت کے سوا
راحتیں اور بھی ہیں وصل کی راحت کے سوا",اس شعر میں شاعر نے محبت اور وصل کے احساسات کے علاوہ دیگر دکھوں اور راحتوں کا ذکر کیا ہے۔ ظاہری مطلب یہ ہے کہ زندگی میں محبت اور وصل کے علاوہ بھی بہت سے دکھ اور راحتیں موجود ہیں۔ بنیادی تشریح یہ ہے کہ شاعر نے محبت اور وصل کو ایک خاص احساس قرار دیا ہے، لیکن اس کے ساتھ ساتھ دیگر زندگی کے پہلوؤں کی طرف بھی اشارہ کیا ہے جو دکھ اور راحت کا باعث بنتے ہیں۔ یہ شعر انسانی زندگی کی پیچیدگی اور کثرت کو بیان کرتا ہے۔
2,احمد فراز,"رنجش ہی سہی دل ہی دکھانے کے لیے آ
آ پھر سے مجھے چھوڑ کے جانے کے لیے آ","شعر کا ظاہری مطلب یہ ہے کہ شاعر اپنی محبت کے درد کو ظاہر کرنے کے لیے رنجش (دکھ) کو ہی اپنے دل میں جگہ دیتا ہے۔ شاعر پھر سے کہتا ہے کہ اگر تم مجھے چھوڑ کر جانا چاہتے ہو تو آ جاؤ۔

بنیادی تشریح: یہ شعر ایک محبت کرنے والے کی انتہائی نزاکت اور درد کا اظہار ہے۔ شاعر اپنے دل کی صدمے اور دکھ کو ایک رنجش کے طور پر ظاہر کرتا ہے، جو اس کے دل میں بے چینی پیدا کرتی ہے۔ شاعر اپنی محبوبہ سے کہتا ہے کہ اگر وہ اسے چھوڑ کر جانا چاہتی ہے تو وہ پھر سے آ جائے۔ یہ شعر ایک عاشق کی بے بسی اور درد کا اظہار ہے، جو اپنی محبوبہ کی فکر مند رہتا ہے۔"
3,فیض احمد فیض,"دل ناامید تو نہیں ناکام ہی تو ہے
لمبی ہے غم کی شام مگر شام ہی تو ہے","اس شعر کا ظاہری مطلب یہ ہے کہ دل کو ناامیدی کا سامنا نہیں ہے، بلکہ ناکامی کا سامنا ہے۔ اگرچہ غم کی شام لمبی ہے، لیکن یہ شام ہی ہے جو ایک نازک اور معمولی وقت ہے۔

تشریح میں، یہ شعر انسانی زندگی کی پیچیدگی اور انتہا پسندی کے خلاف ایک رائے کا اظہار کرتا ہے۔ ""ناامیدی"" کا مطلب ہے کہ کوئی شخص کسی چیز کی امید نہیں رکھتا، جبکہ ""ناکامی"" کا مطلب ہے کہ کوئی شخص اپنے مقصد کو حاصل کرنے میں ناکام ہوتا ہے۔ شاعر کہتا ہے کہ دل ناامید نہیں ہے، بلکہ صرف ناکام ہے، جس سے مراد یہ ہے کہ ہمیں ہمیشہ امید رکھنی چاہیے۔ ""غم کی شام"" سے مراد دکھ اور مصیبت کا وقت ہے، لیکن یہ بھی ایک معمولی وقت ہے جو گزر جائے گا۔ اس طرح، شاعر ہمیں یہ یاد دلاتا ہے کہ مصیبت کا وقت بھی گزر جاتا ہے اور ہمیں ہمیشہ امید اور ہمت سے کام لینا چاہیے۔"
4,جون ایلیا,"جو گزاری نہ جا سکی ہم سے
ہم نے وہ زندگی گزاری ہے",یہ شعر ایک گہری جذباتی کیفیت کو بیان کرتا ہے۔ ظاہری مطلب یہ ہے کہ شاعر نے اپنی زندگی میں کچھ چیزیں حاصل نہیں کر سکا، لیکن اس نے اپنی زندگی اس طرح گزاری ہے جس طرح کہ وہ کرنا چاہتا تھا۔ بنیادی تشریح یہ ہے کہ زندگی میں کچھ خواہشات کی تکمیل نہ ہونے کے باوجود، شاعر نے اپنے ہمت اور ارادے سے زندگی کے تمام مرحلوں کو بھرپور طور پر گزارا ہے۔ اہم تصورات میں قبولِ حقیقت، ارادے کی پاکیزگی اور زندگی کی گہرائی شامل ہیں۔ یہ شعر ہمیں یہ سبق دیتا ہے کہ زندگی میں کامیابی کا مطلب صرف خواہشات کی تکمیل نہیں ہوتا، بلکہ ہمارے ارادے اور ہمت کی پاکیزگی بھی ایک بڑی کامیابی ہے۔
5,مرزا غالب,"ہم کو معلوم ہے جنت کی حقیقت لیکن
دل کے خوش رکھنے کو غالبؔ یہ خیال اچھا ہے",اس شعر میں شاعر غالب اپنی فلسفیانہ سوچ اور حقیقت پسندی کا اظہار کرتے ہوئے کہتے ہیں کہ ہمیں جنت کی حقیقت معلوم ہے، لیکن دل کو خوش رکھنے کے لیے یہ خیال اچھا ہے کہ جنت کی تصویر بنائی جائے۔ اس شعر میں ان کی فلسفیانہ سوچ، حقیقت پسندی اور دل کی خوشی کے تصور کا احاطہ کیا گیا ہے۔ غالب کے نزدیک، حقیقت کی پہچان ضروری ہے، لیکن دل کی خوشی کے لیے کچھ خیالات کو برقرار رکھنا بھی ضروری ہے۔ یہ شعر انسانی زندگی کی پیچیدگیوں اور اس کے دوہرے معنوں کو بیان کرتا ہے۔
6,فیض احمد فیض,"کر رہا تھا غم_جہاں کا حساب
آج تم یاد بے_حساب آئے","اس شعر میں شاعر کا اصل مقصد اپنے دل کی بے_حسابی کا اظہار کرنا ہے۔ ""غم_جہاں"" سے مراد شاعر کے دل میں موجود درد اور غم ہے۔ شاعر کہتا ہے کہ وہ اپنے دل کے غم کا حساب کر رہا تھا، لیکن اچانک ایک ایسی یاد آ گئی جس کا اندازہ نہیں تھا۔ اس یاد کی وجہ سے شاعر کا دل بے_حساب ہو گیا ہے، یعنی اس کے دل میں ایک بے_حساب درد کا احساس ہو گیا ہے۔ یہ شعر ایک عاشق کی زبانی ہے جو اپنی محبوب کی یادوں میں غرق ہے اور اس کے دل میں محبت کا درد بے_حساب ہے۔"
7,راحت اندوری,"اس کی یاد آئی ہے سانسو ذرا آہستہ چلو
دھڑکنوں سے بھی عبادت میں خلل پڑتا ہے",اس شعر کا ظاہری مطلب یہ ہے کہ جب محبوب کی یاد آتی ہے تو سانسیں بھی آہستہ آہستہ چلنے لگتی ہیں اور دل کی دھڑکنوں سے بھی عبادت میں خلل پڑ جاتا ہے۔ یعنی، محبوب کی یاد کی شدت کی وجہ سے تمام طریقے رک جاتے ہیں اور دل کی دھڑکنیں بھی عبادت میں رکاوٹ ڈالتی ہیں۔ یہ شعر محبت کی شدت اور اس کے متاثر کن اثرات کو ظاہر کرتا ہے۔ محبوب کی یاد کی شدت کی وجہ سے تمام ذہنی اور جسمانی عمل رک جاتے ہیں، جس کی وجہ سے عبادت کی روحانی کیفیت بھی متاثر ہوتی ہے۔
8,اکبر الہ آبادی,"ہم آہ بھی کرتے ہیں تو ہو جاتے ہیں بد_نام
وہ قتل بھی کرتے ہیں تو چرچا نہیں ہوتا","اس شعر میں شاعر نے سماجی بے انصافی کا اظہار کیا ہے۔ ظاہری مطلب یہ ہے کہ اگر ہم (عام لوگ) کوئی غلطی کرتے ہیں تو ہماری بدنامی ہو جاتی ہے، لیکن جب طاقتور لوگ کوئی بڑا جرم کرتے ہیں تو اس کا کوئی فرق نہیں پڑتا۔ بنیادی تشریح میں اہم تصورات یہ ہیں کہ سماج میں عدل و انصاف کی کمی ہے اور عام لوگ سماجی اور قانونی بے انصافی کا شکار ہوتے ہیں۔ کلیدی نکات میں یہ شامل ہیں کہ عام لوگ کی چھوٹی موٹی غلطیوں پر تو سماج ناکہ بندی کرتا ہے، جبکہ طاقتور لوگ جب بڑے جرائم کرتے ہیں تو ان کے خلاف کوئی کارروائی نہیں ہوتی۔ الفاظ میں ""آہ""، ""بدنام""، ""قتل"" اور ""چرچا"" کی اصطلاحات سماجی بے انصافی کو اجاگر کرتی ہیں۔"
9,مرزا غالب,"عشق نے غالبؔ نکما کر دیا
ورنہ ہم بھی آدمی تھے کام کے",شعر کا ظاہری مطلب یہ ہے کہ عشق نے غالب کی زندگی کو اتنا بے ساختہ کر دیا کہ وہ ایک معمولی انسان سے ایک کام کے آدمی بن گیا۔ اس شعر کی بنیادی تشریح یہ ہے کہ عشق کے اثرات اتنے گہرے ہوتے ہیں کہ وہ انسان کی زندگی کی تمام تر تبدیلی کر دیتے ہیں۔ غالب کا یہ شعر انسانی جذبات کی عمیق پہلوؤں کو بیان کرتا ہے اور یہ ظاہر کرتا ہے کہ عشق کیسے ایک شخص کی زندگی کو مکمل طور پر متاثر کر سکتا ہے۔ اہم تصورات میں عشق، تبدیلی، انسانی جذبات اور زندگی کی بے ساختگی شامل ہیں۔
10,مرزا غالب,"محبت میں نہیں ہے فرق جینے اور مرنے کا
اسی کو دیکھ کر جیتے ہیں جس کافر پہ دم نکلے","اس شعر کا ظاہری مطلب یہ ہے کہ محبت میں زندگی اور موت کا کوئی فرق نہیں ہوتا۔ محبت کی وجہ سے ہی زندگی کا خوشگوار احساس پیدا ہوتا ہے، جبکہ اگر محبت نہ ہو تو زندگی بے معنی ہو جاتی ہے۔ اسی کو دیکھ کر زندگی کی خوشی کا احساس ہوتا ہے جس پر محبت کا دم نکلتا ہے۔

اس شعر کی بنیادی تشریح میں، محبت کے تصور کو بنیادی کردار میں رکھا گیا ہے۔ محبت کو زندگی اور موت کا فرق مٹانے کی صلاحیت رکھنے والی قوت ظاہر کیا گیا ہے۔ شاعر کا مقصد یہ بیان کرنا ہے کہ محبت زندگی کی اصل روح ہے اور اس کے بغیر زندگی بے معنی ہو جاتی ہے۔ شعر کے دوسرے حصے میں، محبت کا تصور اور بھی گہرا کیا گیا ہے، جہاں محبت کو زندگی کی خوشی کا اصل ذریعہ ظاہر کیا گیا ہے۔ یہاں ""جس کافر پہ دم نکلے"" سے مراد ایسی کافر جگہ ہے جہاں محبت کا دم نکلتا ہے، یعنی جہاں محبت کا اظہار ہوتا ہے۔ اس طرح، شعر کا مطلب یہ نکلتا ہے کہ محبت ہی زندگی کا اصل معنی اور خوشی کا ذریعہ ہے۔"
11,بشیر بدر,"نہ جی بھر کے دیکھا نہ کچھ بات کی
بڑی آرزو تھی ملاقات کی","اس شعر میں، شاعر اپنی ایک ناتمام خواہش کا اظہار کرتا ہے جسے وہ پورا نہیں کر سکا۔ ""نہ جی بھر کے دیکھا"" سے مراد یہ ہے کہ شاعر نے اپنی خواہش کو پورا نہیں کیا، اور ""نہ کچھ بات کی"" سے یہ ظاہر ہوتا ہے کہ اس نے اپنی جانب سے کوئی کوشش بھی نہیں کی۔ ""بڑی آرزو تھی ملاقات کی"" سے پتہ چلتا ہے کہ شاعر کی خواہش کسی سے ملاقات کی تھی، لیکن اس نے اس خواہش کو پورا نہیں کیا۔ اس شعر میں شاعر کی ناتمام خواہش اور اس کی بے یقینی کا احساس بھرپور ہے۔"
12,علامہ اقبال,"خودی کو کر بلند اتنا کہ ہر تقدیر سے پہلے
خدا بندے سے خود پوچھے بتا تیری رضا کیا ہے","اس شعر کا ظاہری مطلب یہ ہے کہ انسان کو اپنی خودی (اپنی شخصیت اور اقدار) کو ایسا بلند کرنا چاہیے کہ ہر تقدیر (قسمت) سے پہلے، خدا انسان سے پوچھے کہ اس کی رضا کیا ہے۔

بنیادی تشریح:
اس شعر میں خودی کی اہمیت کو بیان کیا گیا ہے۔ خودی کا مطلب ہے اپنی شخصیت، اقدار اور اپنی پہچان کی حفاظت کرنا۔ شاعر کہتا ہے کہ انسان کو اپنی خودی کو ایسا بلند کرنا چاہیے کہ خدا بھی انسان سے پوچھے کہ اس کی رضا (منظوری) کیا ہے۔ یہاں رضا کا مطلب ہے انسان کی خواہش اور اس کی قسمت کا ایک دوسرے سے مطابقت۔ شاعر کا مقصد یہ ہے کہ انسان اپنی خودی کو ایسا بنائے کہ وہ اپنی تقدیر پر غلبہ رکھ سکے اور خدا بھی اس کی رضامندی کو اہمیت دے۔"
13,احمد فراز,"اب کے ہم بچھڑے تو شاید کبھی خوابوں میں ملیں
جس طرح سوکھے ہوئے پھول کتابوں میں ملیں","اس شعر کا ظاہری مطلب یہ ہے کہ اب کے بعد کبھی ہم دوبارہ ملیں گے، جس طرح سوکھے ہوئے پھول کتابوں کے صفحات میں پائے جاتے ہیں۔

اس شعر کی بنیادی تشریح یہ ہے کہ شاعر فراق اور انتظار کی کیفیت کا اظہار کر رہا ہے۔ ""اب کے ہم بچھڑے"" سے مراد فراق کی کیفیت کا اظہار ہے، جبکہ ""شاید کبھی خوابوں میں ملیں"" سے انتظار اور امید کی جھلک دکھائی دیتی ہے۔ سوکھے ہوئے پھول کی تشبیہ اس بات کو ظاہر کرتی ہے کہ اگرچہ فلانی چیز زندگی میں نہیں رہی، لیکن وہ ہماری یادوں اور خوابوں میں زندہ رہتی ہے۔ یہ شعر محبت، فراق اور انتظار کے مختلف پہلوؤں کو بیان کرتا ہے۔"
14,ندا فاضلی,"ہوش والوں کو خبر کیا بے_خودی کیا چیز ہے
عشق کیجے پھر سمجھئے زندگی کیا چیز ہے",یہ شعر عشق اور بے خودی کے تصور پر مبنی ہے۔ ظاہری مطلب یہ ہے کہ ہوش والے لوگ بے خودی کی حقیقت کیا سمجھ سکتے ہیں۔ عشق کرنے سے ہی زندگی کی اصل حقیقت کا احساس ہوتا ہے۔ شاعر یہاں عشق کو زندگی کی سمجھ کا بنیادی ذریعہ قرار دیتا ہے۔ بنیادی تشریح میں یہ دیکھا جا سکتا ہے کہ عشق ایک ایسی کیفیت ہے جو انسان کو خود سے دور کرتی ہے، جس سے اسے زندگی کی اصل قدر کا احساس ہوتا ہے۔ ہوش والے لوگ جو عقل و شعور سے کام لیتے ہیں، وہ بے خودی کی حقیقت کو نہیں سمجھ سکتے۔ لہٰذا، عشق کرنا ضروری ہے تاکہ زندگی کی اصل حقیقت کا احساس ہو سکے۔
15,مرزا غالب,"اس سادگی پہ کون نہ مر جائے اے خدا
لڑتے ہیں اور ہاتھ میں تلوار بھی نہیں",اس شعر میں شاعر اپنی سادگی اور بے یاری کا اظہار کرتا ہے۔ ظاہری مطلب یہ ہے کہ شاعر کسی سادہ اور بے یار شخصیت کی طرف اشارہ کر رہا ہے جس کی سادگی پر ہر کوئی مر جاتا ہے، حالانکہ اس شخصیت کے پاس کوئی تلوار یا ہتھیار نہیں ہے۔ بنیادی تشریح یہ ہے کہ شاعر اپنی بے یاری اور بے بسی کا اظہار کرتا ہے کہ اس کے پاس کوئی ہتھیار نہیں ہے جس سے وہ اپنے دشمنوں سے لڑ سکے، لیکن پھر بھی وہ لڑتا رہتا ہے۔ یہ سادگی اور بے یاری کا مجموعہ ہے جو شاعر کی صداقت اور استقلال کو ظاہر کرتا ہے۔
16,فیض احمد فیض,"اور کیا دیکھنے کو باقی ہے
آپ سے دل لگا کے دیکھ لیا",یہ شعر ایک عاشق کا اظہار ہے جس نے اپنے عشق میں دل لگا دیا ہے اور اب اس کے لیے دنیا میں دیکھنے کو کوئی اور چیز باقی نہیں رہی۔ شعر میں عشق کا اعتراف، دل لگانے کی کیفیت اور دنیا کی بے رخی کے تصورات شامل ہیں۔ اس سے عاشق کی وفا اور اخلاص کا پتہ چلتا ہے کہ اس کے لیے اپنے محبوب کے علاوہ کوئی دوسری چیز اہم نہیں رہی۔
17,فراق گورکھپوری,"ایک مدت سے تری یاد بھی آئی نہ ہمیں
اور ہم بھول گئے ہوں تجھے ایسا بھی نہیں","یہ شعر عشق اور فراق کے احساسات کی عکاسی کرتا ہے۔ ظاہری مطلب یہ ہے کہ شاعر کچھ عرصے سے اپنی محبوب کی یاد بھی نہیں آئی اور نہ ہی شاعر نے اسے بھولا ہے۔ بنیادی تشریح یہ ہے کہ شاعر کے دل میں ایسی کیفیت پیدا ہو گئی ہے جس میں وہ نہ تو محبوب کی یاد کر سکتا ہے اور نہ ہی اسے بھول سکتا ہے۔ یہ ایک انتہائی دلچسپ اور پیچیدہ کیفیت ہے جس میں شاعر کا دل محبوب کی یاد میں بے یقینی اور بے چینی کا شکار ہے۔ اس شعر میں ""یاد"" اور ""بھولنا"" دو اہم تصورات ہیں جو شاعر کی دلی حالت کا اظہار کرتے ہیں۔"
18,علامہ اقبال,"مانا کہ تیری دید کے قابل نہیں ہوں میں
تو میرا شوق دیکھ مرا انتظار دیکھ","یہ شعر محبت اور انتظار کے جذبات کو بیان کرتا ہے۔ ظاہری مطلب یہ ہے کہ شاعر اپنی محبوبہ سے کہتا ہے کہ اگرچہ وہ اس کے قابل نہیں، لیکن اس کے شوق اور انتظار کو دیکھیں۔

بنیادی تشریح میں، اہم تصورات محبت، شوق، انتظار اور اپنی قدر کا تعین شامل ہیں۔ شاعر کا یہ اعتراف اس کی عظمت کو ظاہر کرتا ہے کہ وہ اپنی محبوبہ کے لیے اپنی کمیوں کو تسلیم کرتا ہے، مگر اس کا شوق اور انتظار اس کی صداقت اور استقامت کو ظاہر کرتا ہے۔ اس شعر میں ""دید"" کا لفظ دیکھنے کی صلاحیت کو ظاہر کرتا ہے، جبکہ ""شوق"" اور ""انتظار"" گہری محبت اور استقامت کے جذبات کو بیان کرتے ہیں۔"
19,مرزا غالب,"ہزاروں خواہشیں ایسی کہ ہر خواہش پہ دم نکلے
بہت نکلے مرے ارمان لیکن پھر بھی کم نکلے","یہ شعر فارسی شاعر فیض احمد فیض کا ہے جو انسانی خواہشات اور ارمان کی بے انتہا پیاس کو بیان کرتا ہے۔ شاعر کہتا ہے کہ انسان کی خواہشیں ہزاروں ہیں اور ہر خواہش پوری ہوتے ہی دم نکلتی ہے۔ اس کے باوجود بہت سے ارمان پورے ہوتے ہیں، لیکن پھر بھی ایک کمی کا احساس رہتا ہے۔ یہ انسانی فطرت کی بے چینی کو بیان کرتا ہے جو کبھی خاموش نہیں ہوتی۔

اہم تصورات:
1. **خواہشیں**: انسانی خواہشات کی بے انتہا پیاس۔
2. **ارمان**: انسانی ارمانوں کی پوری ہونے کی صورت میں بھی کمی کا احساس۔
3. **انسانی فطرت**: انسان کی بے چینی جو کبھی ختم نہیں ہوتی۔

کلیدی نکات:
- خواہشوں کی بے انتہا تعداد۔
- ہر خواہش کے پورے ہونے کے باوجود کمی کا احساس۔
- انسانی فطرت میں بے چینی کا عنصر۔"
20,انور شعور,"اچھا خاصا بیٹھے بیٹھے گم ہو جاتا ہوں
اب میں اکثر میں نہیں رہتا تم ہو جاتا ہوں","اس شعر کا ظاہری مطلب یہ ہے کہ شاعر کا خیال اکثر ایک ہی جگہ بیٹھے بیٹھے گم ہو جاتا ہے۔ شاعر اپنے وجود میں ایک تیزی سے کمی کا احساس کرتا ہے اور لگتا ہے کہ وہ خود کو کھو بیٹھا ہے، بلکہ اب اس کی جگہ کوئی اور ہی ہو گیا ہے۔

بنیادی تشریح میں، یہ شعر شاعر کی ذہنی حالت کا اظہار کرتا ہے، جہاں وہ اپنے وجود کو محسوس نہیں کر پاتا ہے۔ ""گم ہو جاتا ہوں"" کا مطلب ہے کہ شاعر اپنے خیالات میں کھو جاتا ہے، جبکہ ""اب میں اکثر میں نہیں رہتا"" سے مراد یہ ہے کہ شاعر اپنے وجود کا احساس کھو چکا ہے۔ ""تم ہو جاتا ہوں"" سے ظاہر ہوتا ہے کہ شاعر کی جگہ کوئی اور حاصل کر لیتا ہے، جس سے شاعر کی ذہنی بے چینی کا اندازہ ہوتا ہے۔ یہ شعر ذہنی بے چینی، وجودی جدائی اور انسانی وجود کی کمزوری کو بیان کرتا ہے۔"
21,عبید اللہ علیم,"عزیز اتنا ہی رکھو کہ جی سنبھل جائے
اب اس قدر بھی نہ چاہو کہ دم نکل جائے",یہ شعر محبت اور توازن کے اہم تصورات کو ظاہر کرتا ہے۔ شاعر کا مقصد یہ بتانا ہے کہ محبت میں اتنا لطف اور عزت رکھی جائے کہ دل کو سکون ملے، لیکن اتنا زیادہ نہ کہ اس سے دم گھٹ جائے۔ یہ توازن ضروری ہے تاکہ محبت کا احساس سکون کا باعث بنے، نہ کہ تکلیف اور پریشانی کا۔ شاعر کا یہ پیغام ہے کہ محبت میں سمجھداری اور قدر کی ضرورت ہوتی ہے تاکہ اس سے دل کی سکون اور خوشی مل سکے، نہ کہ غم اور تکلیف۔
22,علامہ اقبال,"ستاروں سے آگے جہاں اور بھی ہیں
ابھی عشق کے امتحاں اور بھی ہیں","اس شعر کا ظاہری مطلب یہ ہے کہ ستاروں سے آگے بھی دنیائیں موجود ہیں، اور محبت کے امتحانات بھی ابھی ختم نہیں ہوئے ہیں۔ اس کا بنیادی تشریح میں یہ مرکزی تصورات شامل ہیں:

1. **ستاروں سے آگے جہاں**: یہ بیان کرتا ہے کہ انسانی علم اور سمجھ کی حدود سے پرے بھی کائنات کے خفیہ پہلو ہیں۔ ستارے، جو انسانی دیدہ ریزی کی حد تک پہنچنے کا ایک علامتی نشان ہیں، ان کے آگے بھی ایسی دنیائیں موجود ہیں جن تک ہماری رسائی ابھی نہیں ہوئی۔

2. **ابھی عشق کے امتحاں اور بھی ہیں**: یہ ایک روحانی اور محبت کا تصور پیش کرتا ہے۔ محبت کا سفر ایک مسلسل عمل ہے جس میں ہمیشہ نئے امتحانات اور چیلنجز موجود ہیں۔ محبت کی راہ میں کبھی بھی ایک نقطہ نہیں آتا جہاں امتحانات ختم ہو جائیں۔

اس شعر میں امید اور نئی تلاش کا تصور بھی شامل ہے۔ یہ بتاتا ہے کہ محبت اور زندگی کی تلاش میں ہمیشہ نئی سرزمینیں اور نئے امتحانات موجود ہوتے ہیں جن کا مقابلہ کرنا ضروری ہے۔"
