,Poet_Name,Couplet,Interpretation
199,جون ایلیا,"میری بانہوں میں بہکنے کی سزا بھی سن لے
اب بہت دیر میں آزاد کروں_گا تجھ کو",اس شعر میں شاعر اپنی محبوبہ سے خطاب کرتے ہوئے کہتا ہے کہ اگر اس نے اپنی باہوں میں بہکنے کی سزا سن لی ہے تو وہ اسے بہت دیر تک آزاد نہیں کرے گا۔ یہ شعر ایک انتہائی عمیق اور جذباتی تعلق کو ظاہر کرتا ہے جہاں شاعر اپنے جذبات کا اظہار کرتے ہوئے محبوبہ کے ساتھ اپنی جواب دہی کا انتظار کر رہا ہے۔ اس میں محبت، انتظار اور تعلق کی گہرائی کو بیان کیا گیا ہے۔
200,احمد فراز,"ہم کو اچھا نہیں لگتا کوئی ہم_نام ترا
کوئی تجھ سا ہو تو پھر نام بھی تجھ سا رکھے",اس شعر میں شاعر نے ایک محبت کرنے والے کی جذبات کا اظہار کیا ہے۔ ظاہری مطلب یہ ہے کہ شاعر کو یہ پسند نہیں آتا کہ کوئی اور شخص اسی نام کا ہو جس نام کی وہ عقیدت رکھتا ہے۔ اس کی وجہ یہ ہے کہ اگر کوئی دوسرا شخص اسی نام کا ہوگا تو شاعر کے محبوب کے نام کی خوبصورتی اور انفرادیت ختم ہو جائے گی۔ شاعر کا یہ خواہش مند ہے کہ اگر کوئی شخص اسی نام کا ہو تو وہ شخص بھی اسی طرح اور اسی خوبصورتی کا مالک ہو جیسے شاعر کا محبوب ہے۔ اس طرح یہ شعر محبت میں انفرادیت کی اہمیت کو اجاگر کرتا ہے۔
201,گلزار,"زندگی یوں ہوئی بسر تنہا
قافلہ ساتھ اور سفر تنہا","اس شعر میں شاعر نے زندگی کی تنہائی کا احساس اور اس کی پیچیدگی کو بیان کیا ہے۔ ظاہری مطلب یہ ہے کہ زندگی تنہائی میں گذر گئی، باوجود اس کے کہ لوگ ساتھ تھے لیکن اصل میں سفر تنہائی میں تھا۔

بنیادی تشریح میں، ""زندگی"" کا لفظ زندگی کی پوری راہ کو ظاہر کرتا ہے، جبکہ ""تنہائی"" کا لفظ زندگی کی سوچ اور احساسات کی تنہائی کو بیان کرتا ہے۔ ""قافلہ"" کا لفظ ان لوگوں کی نمائندگی کرتا ہے جو زندگی کے سفر میں ساتھ چلتے ہیں، جبکہ ""سفر"" کا لفظ زندگی کے سفر کو ظاہر کرتا ہے۔ شاعر کا یہاں احساس یہ ہے کہ باوجود لوگوں کے ساتھ ہونے کے، اندرونی تنہائی نے زندگی کو تنہا کر دیا ہے۔"
202,فیض احمد فیض,"آئے تو یوں کہ جیسے ہمیشہ تھے مہربان
بھولے تو یوں کہ گویا کبھی آشنا نہ تھے",اس شعر کا ظاہری مطلب یہ ہے کہ کسی شخص کے آنے سے ہمیشہ کی مہربانی کا احساس ملتا ہے، لیکن اگر وہ بھول جائے تو ایسا لگتا ہے کہ کبھی آشنا نہیں تھے۔ شاعر اس شعر میں انسانی مہربانی اور اس کی عدم موجودگی کے اثرات کو بیان کرتا ہے۔ اہم تصورات میں مہربانی، آشنائی اور بھولنے کا احساس شامل ہیں۔ شاعر کا مرکزی نکتہ یہ ہے کہ مہربانی انسانی رشتوں کو مضبوط بناتی ہے، لیکن اس کی فقدان میں رشتے ایسے لگتے ہیں جیسے کبھی نہیں تھے۔
203,ندا فاضلی,"بچوں کے چھوٹے ہاتھوں کو چاند ستارے چھونے دو
چار کتابیں پڑھ کر یہ بھی ہم جیسے ہو جائیں_گے",شعر کا ظاہری مطلب یہ ہے کہ بچوں کو آزادی دی جائے تاکہ وہ اپنے چھوٹے ہاتھوں سے چاند و ستارے چھو سکیں، جس سے کہ وہ بڑے ہو کر ہم جیسے ذمہ دار اور علم دوست بن سکیں۔ اس شعر میں بنیادی تشریح یہ ہے کہ تعلیم کی اہمیت پر زور دیا گیا ہے، کیونکہ تعلیم ہی انسان کو اس کی منزل تک پہنچاتی ہے۔ بچوں کی آزادی اور خواہشات کا احترام کرنا بھی ان کی ترقی میں مددگار ثابت ہوتا ہے۔ اس شعر کے ذریعے یہ بھی قائل کیا گیا ہے کہ تعلیم سے ہی انسان کی خواہشات کی تکمیل ممکن ہوتی ہے۔
204,امیر قزلباش,"مرے جنوں کا نتیجہ ضرور نکلے_گا
اسی سیاہ سمندر سے نور نکلے_گا","یہ شعر دگ کی نظم میں سے ہے۔ ظاہری مطلب یہ ہے کہ شاعر اپنی جوش و جذبے کے نتیجے میں، ایک اندھیرے سمندر سے روشنی کی تلاش کرتا ہے۔ بنیادی تشریح میں، ""مرے جنوں"" شاعر کی جوشیلی اور بے چینی کو ظاہر کرتا ہے۔ ""نتیجہ"" سے مراد اس جذبے کا انجام ہے۔ ""سیاہ سمندر"" اندھیرے اور ناامیدی کی علامت ہے، جبکہ ""نور"" روشنی اور امید کی نمائندگی کرتا ہے۔ شاعر کا یقین ہے کہ اندھیرے سے بھی روشنی نکل سکتی ہے، جس سے امید اور استقلال کا پیغام ملتا ہے۔"
205,داغؔ دہلوی,"ہمیں ہے شوق کہ بے_پردہ تم کو دیکھیں_گے
تمہیں ہے شرم تو آنکھوں پہ ہاتھ دھر لینا",اس شعر میں شاعر اپنی خواہش کا اظہار کرتا ہے کہ وہ اپنے محبوب کو بے پردہ (بغیر کسی حجاب کے) دیکھنا چاہتا ہے۔ لیکن محبوب کی طرف سے شرم کی وجہ سے یہ ناممکن ہے۔ شاعر کی خواہش کو پورا کرنے کی بجائے، محبوب کو شرم آتی ہے اور اسے اپنی آنکھوں پر ہاتھ رکھنا پڑتا ہے۔ یہ شعر عشق کی بے بسی، خواہشوں کی ناتوانی اور محبت میں شرم کا احساس بیان کرتا ہے۔
206,بشیر بدر,"سر جھکاؤ_گے تو پتھر دیوتا ہو جائے_گا
اتنا مت چاہو اسے وہ بے_وفا ہو جائے_گا",اس شعر میں، شاعر نے انسانی رشتوں اور ان کی حقیقت کو بیان کیا ہے۔ اس کا ظاہری مطلب یہ ہے کہ اگر ہم کسی کے لیے زیادہ سر جھکاتے ہیں تو وہ شخص ہمارے لیے پتھر دیوتا بن جائے گا، یعنی بے جان اور بے روح ہو جائے گا۔ اگر ہم کسی کو زیادہ چاہیں گے، تو وہ بے وفا ہو جائے گا۔ بنیادی تشریح میں، شاعر اس بات پر زور دیتا ہے کہ انسانی رشتوں میں اتنی خود کشی نہیں کرنی چاہیے کہ دوسرا فرد اس کی قدر کرنے کی بجائے بے وفائی کا شکار ہو جائے۔
207,وسیم بریلوی,"دکھ اپنا اگر ہم کو بتانا نہیں آتا
تم کو بھی تو اندازہ لگانا نہیں آتا",اس شعر میں شاعر اپنے درد کو بیان کرنے کی عدم توانائی کا اظہار کرتا ہے۔ شعر کا ظاہری مطلب یہ ہے کہ شاعر اپنے دکھ کو بیان کرنے میں ناکام ہے، اور اس کے ساتھ ہی دوسرے کو بھی اس کا اندازہ لگانے میں دشواری ہوتی ہے۔ بنیادی تشریح میں یہ نکات شامل ہیں: عدم توانائی، دکھ، اندازہ اور بیان کرنا۔ شعر کے مرکزی تصورات میں احساسات کی عدم توانائی اور ان کے بیان کی کثرت شامل ہے۔ یہ شعر ایک بے بسی کا اظہار ہے جو انسانی فطرت کی ایک اہم جھلک ہے۔
208,اسرار الحق مجاز,"کچھ تمہاری نگاہ کافر تھی
کچھ مجھے بھی خراب ہونا تھا","یہ شعر ایک عاشق کی طرف سے اپنے محبوب کی طرف سے ایک خاص طور پر نگاہ کی طرف اشارہ کرتا ہے جس کی وجہ سے عاشق کی حالت خراب ہو گئی۔ شعر کے پہلے حصے میں ""کچھ تمہاری نگاہ کافر تھی"" کا مطلب ہے کہ محبوب کی نگاہ میں کچھ ایسا تھا جس نے عاشق کو بے چین کر دیا۔ دوسرے حصے میں ""کچھ مجھے بھی خراب ہونا تھا"" کا مطلب ہے کہ عاشق کی حالت بھی خراب تھی، جس کی وجہ سے وہ محبوب کی نگاہ سے متاثر ہوا۔

اس شعر میں اہم تصورات میں عشق، نگاہ، خرابی اور متاثر ہونا شامل ہیں۔ یہ شعر عاشق کی بے بسی اور اس کی حالت کو ظاہر کرتا ہے جو محبوب کی نگاہ سے متاثر ہوتی ہے۔ اس میں عاشق کا احساس بھی شامل ہے کہ محبوب کی نگاہ کی وجہ سے اس کی حالت خراب ہو گئی ہے۔"
209,جون ایلیا,"میں رہا عمر بھر جدا خود سے
یاد میں خود کو عمر بھر آیا","شعر کا ظاہری مطلب یہ ہے کہ شاعر اپنی زندگی میں ہمیشہ اپنے آپ سے جدا رہا ہے اور اپنے آپ کی یاد میں عمر بھر گزارا ہے۔

بنیادی تشریح: اس شعر میں شاعر نے اپنی پہچان اور اپنے آپ سے جدائی کے احساس کو بیان کیا ہے۔ ""عمر بھر جدا"" کا مطلب ہے کہ شاعر کبھی بھی اپنے آپ کو پوری طرح سے نہیں سمجھ سکا۔ ""خود کو یاد میں آیا"" سے مراد ہے کہ شاعر ہمیشہ اپنے آپ کی تلاش میں رہا، لیکن کبھی اسے اپنی اصل پہچان حاصل نہیں ہو سکی۔ اس شعر میں انسان کی پہچان کی تلاش، اپنے آپ سے جدائی کا دکھ اور اپنے آپ کو سمجھنے کی کوشش کے الگاو کو بیان کیا گیا ہے۔"
210,ناصر کاظمی,"وہ کوئی دوست تھا اچھے دنوں کا
جو پچھلی رات سے یاد آ رہا ہے","اس شعر کا ظاہری مطلب یہ ہے کہ شاعر اپنے ایک دوست کو یاد کر رہا ہے جو اچھے دنوں میں اس کا ساتھی تھا۔ یہ دوست اچانک پچھلی رات سے شاعر کی یادوں میں آگیا ہے۔

بنیادی تشریح میں، اہم تصورات جو اس شعر میں شامل ہیں، یادوں کا تعلق اور اچھے دنوں کی تاثرات ہیں۔ شاعر کا دوست ایک خوشگوار زمانے کا حصہ تھا، اور اس کی یاد اچانک طور پر پچھلی رات سے شاعر کی ذہن میں آگئی ہے۔ یہ شعر نا صرف دوستی کی قدر کو اجاگر کرتا ہے بلکہ گزرے ہوئے اچھے دنوں کی یادوں کی نفاست بھی بیان کرتا ہے۔"
211,فراق گورکھپوری,"تیرے آنے کی کیا امید مگر
کیسے کہہ دوں کہ انتظار نہیں","یہ شعر ایک عاشق کی جانب سے اپنے محبوب سے خطاب کیا گیا ہے۔ ظاہری مطلب یہ ہے کہ عاشق کو امید ہے کہ اس کا محبوب اس کے پاس آئے گا، لیکن وہ اس کے انتظار میں نہیں ہے۔ یہ ایک دھندلا سا انداز ہے جس میں عاشق اپنی بے یقینی کا اظہار کرتا ہے۔

بنیادی طور پر، شعر کا تشریح یہ ہے کہ عاشق اپنے محبوب کی آمد کی امید رکھتا ہے لیکن اس کے انتظار میں نہیں ہے، جو اس کی بے یقینی اور اندرونی تنہائی کا اظہار کرتا ہے۔ یہ شعر عاشق کی جذباتی حالت کو بیان کرتا ہے جہاں وہ اپنے محبوب کے آنے کی امید رکھتا ہے لیکن اس کے انتظار میں نہیں ہے، جو اس کی بے یقینی اور اندرونی تنہائی کا اظہار کرتا ہے۔"
212,مرزا غالب,"رنج سے خوگر ہوا انساں تو مٹ جاتا ہے رنج
مشکلیں مجھ پر پڑیں اتنی کہ آساں ہو گئیں",اس شعر میں شاعر نے مشکلات کو انسانی زندگی کا ایک لازمی حصہ قرار دیا ہے۔ شعر کا ظاہری مطلب یہ ہے کہ انسان مشکلات کی وجہ سے تو تکلیف میں مبتلا ہوتا ہے لیکن وقت گزرنے کے ساتھ ساتھ رنج و مصیبت خود بخود ختم ہو جاتی ہے۔ شاعر کا کہنا ہے کہ انسان پر اتنی مشکلات پڑھیں کہ ان کے باوجود زندگی آساں ہو جاتی ہے، یعنی مشکلات انسان کو اپنی قوت اور دھیرج کا احساس دلاتی ہیں اور اسے زندگی کے مختلف پہلوؤں کا سامنا کرنے کی صلاحیت عطا کرتی ہیں۔ شعر میں اہم تصورات میں رنج، مشکلات، انسانیت، قوت، دھیرج اور زندگی کی تلخی شامل ہیں۔
213,جون ایلیا,"زندگی ایک فن ہے لمحوں کو
اپنے انداز سے گنوانے کا",اس شعر کا ظاہری مطلب یہ ہے کہ زندگی ایک فن ہے جس میں ہم اپنے انداز سے لمحوں کو گنواتے ہیں۔ بنیادی تشریح یہ ہے کہ زندگی کسی کے ساتھ کیسے گزرتی ہے، اس میں ہمارے انداز اور رویے کا بڑا کردار ہوتا ہے۔ ہر لمحہ ایک فنکارانہ تخلیق ہے جسے ہم اپنے انداز میں سجاتے ہیں۔ اس میں ہماری شخصیت، ذوق اور سوچ کا اظہار ہوتا ہے۔ یہ شعر ہمیں یاد دلاتا ہے کہ زندگی محض گزرنے کا نام نہیں، بلکہ اسے اپنے انداز سے جینا ایک فن ہے۔
214,منیر نیازی,"کسی کو اپنے عمل کا حساب کیا دیتے
سوال سارے غلط تھے جواب کیا دیتے","اس شعر میں، شاعر کسی کے اعمال کا حساب کیتے ہوئے اسے غلطی کا سوال کرتا ہے، جس کا جواب بھی غلط ہوتا ہے۔ یہ شعر انسانی زندگی کی پیچیدگیاں ظاہر کرتا ہے، جہاں ہم اپنے اعمال کے حساب سے خود کو محدود کر لیتے ہیں اور غلط فہمیوں کے شکار ہو جاتے ہیں۔ شعر کے دو حصے ہیں: ""کسی کو اپنے عمل کا حساب کیا دیتے"" اور ""سوال سارے غلط تھے جواب کیا دیتے""۔ پہلا حصہ انسانی عمل کی حساب کتاب کی طرف اشارہ کرتا ہے، جبکہ دوسرا حصہ غلط فہمیوں اور جوابوں کی طرف اشارہ کرتا ہے۔ اس شعر کے ذریعے شاعر انسانی زندگی کی پیچیدگیاں اور غلط فہمیوں کے نتائج کو بیان کرتا ہے۔"
215,شکیل بدایونی,"اب تو خوشی کا غم ہے نہ غم کی خوشی مجھے
بے_حس بنا چکی ہے بہت زندگی مجھے","اس شعر میں شاعر اپنے جذبات کا اظہار کرتے ہوئے بتاتا ہے کہ زندگی کی طویل جدوجہد نے اسے بے حس بنا دیا ہے۔ اب نہ خوشی اسے خوش کرتی ہے اور نہ غم اسے غمگین کرتا ہے۔ یہ ایک ایسی انتہائی حالت کا احساس ہے جہاں شاعر کے جذبات کو کوئی اثر نہیں کرتا۔ زندگی کے بہت سے تجربات نے شاعر کو ایسا بنا دیا ہے کہ وہ نہ خوشی کا احساس کر سکتا ہے اور نہ غم کا۔ اس شعر میں ""غم"" اور ""خوشی"" کے الفاظ بار بار استعمال ہونے کی وجہ سے جذباتی فرق کو بھی دکھایا گیا ہے۔ شاعر کے لیے ""زندگی"" ایک ایسا تجربہ ہے جو اسے بے حس کر چکا ہے، جس کا مطلب ہے کہ زندگی کے تمام تجربات نے اسے اس قدر تھکا دیا ہے کہ اب کوئی جذباتی احساس اسے متاثر نہیں کرتا۔"
216,دشینت کمار,"کیسے آکاش میں سوراخ نہیں ہو سکتا
ایک پتھر تو طبیعت سے اچھالو یارو","یہ شعر بلاگ کی طرف سے کائنات کی عظمت اور انسانی حدود کو بیان کرتا ہے۔ ظاہری مطلب یہ ہے کہ آکاش (آسمان) میں سوراخ نہیں ہو سکتا، کیونکہ ایک پتھر کو طبیعت سے باہر پھینکنا ممکن نہیں۔ اس شعر میں آکاش کی بے پایانی کے ساتھ انسانی حدود کا موازنہ کیا گیا ہے۔

اس شعر کی بنیادی تشریح میں، آسمان کی بے پایانی کو ایک ایسی چیز کے طور پر پیش کیا گیا ہے جس میں سوراخ نہیں ہو سکتا، کیونکہ اس کی بے پایانی کی وجہ سے کوئی بھی پتھر اس میں سوراخ نہیں بنا سکتا۔ یہ انسانی حدود کی طرف اشارہ کرتا ہے کہ انسان کی طاقت اور صلاحیتیں بھی محدود ہیں اور کائنات کی عظمت کے سامنے کوئی معنی نہیں رکھتیں۔ اس طرح، یہ شعر انسان کو اپنی حدود کا احساس دلاتا ہے اور کائنات کی عظمت اور طبیعت کی قدرت پر زور دیتا ہے۔"
217,اکبر الہ آبادی,"آئی ہوگی کسی کو ہجر میں موت
مجھ کو تو نیند بھی نہیں آتی","اس شعر میں شاعر نے تین اہم تصورات کو بیان کیا ہے: فراق، بے نیندی اور انتظار کی موت. شعر کا ظاہری مطلب یہ ہے کہ شاعر کسی کے فراق میں اتنا متاثر ہے کہ اسے نیند بھی نہیں آتی، جبکہ اس کے انتظار میں کسی کو موت آ گئی ہوگی. بنیادی تشریح میں، اس شعر کا مرکزی نکتہ یہ ہے کہ فراق کی صدمہ اتنا گہرا ہوتا ہے کہ اس سے نیند بھی ختم ہو جاتی ہے، اور اس انتظار میں زندگی کے لمحے بھی گزر جاتے ہیں، جیسے موت آ گئی ہو۔ شعر میں ""ہجر"" اور ""موت"" کے الفاظ سے مراد محبوب کی دوری اور اس دوری کی تکلیف سے ہے۔"
218,مرزا غالب,"عشق سے طبیعت نے زیست کا مزا پایا
درد کی دوا پائی درد_بے_دوا پایا","اس شعر میں، شاعر نے عشق کی قوت اور اس کے زندگی پر گہرے اثرات کو بیان کیا ہے۔ ظاہری طور پر، شعر کا مطلب یہ ہے کہ عشق نے زندگی میں خوشی اور ایک عجیب سا احساس پیدا کیا ہے۔ اس نے زندگی میں درد کی دوا بھی پائی، لیکن یہ درد بے دوا ثابت ہوا۔

بنیادی تشریح میں، شاعر نے عشق کے دوران انسان کی زندگی میں آنے والے تبدیلیوں کو بیان کیا ہے۔ عشق سے طبیعت (انسانی فطرت) نے زندگی کا مزا پایا، جس سے مراد یہ ہے کہ عشق نے زندگی میں ایک نئی روشنی اور خوشی لائی ہے۔ درد کی دوا پائی کہنے سے مراد یہ ہے کہ عشق نے زندگی کے درد کو دور کیا ہے، لیکن یہ درد بے دوا ہے، جس کا مطلب یہ ہے کہ عشق کا درد ایسا ہے جس کی کوئی دوا نہیں ہے۔ یہاں پر ""بے دوا"" کا لفظ عشق کی تاب کو ظاہر کرتا ہے جس میں کوئی شفا نہیں ہے۔"
219,پروین شاکر,"اتنے گھنے بادل کے پیچھے
کتنا تنہا ہوگا چاند",یہ شعر کسی ایک کے لیے تنہائی کی حالت کا احساس ظاہر کرتا ہے۔ چاند کی تنہائی، جسے گھنے بادل نے چھپا رکھا ہے، کو انسانی زندگی کی تنہائی سے موازنہ کیا جا سکتا ہے۔ یہ شعر ایک ایسے شخص کی کیفیت کا اظہار کرتا ہے جسے دنیا کی ہڑبڑی سے دور کر دیا گیا ہو، لیکن اس کے باوجود وہ اپنی روشنی کو برقرار رکھتا ہے۔ یہ شعر میں ایک اہم تصور یہ بھی ہے کہ تنہائی میں بھی روشنی اور امید کا احساس قائم رہتا ہے۔
220,آسی الدنی,"اپنی حالت کا خود احساس نہیں ہے مجھ کو
میں نے اوروں سے سنا ہے کہ پریشان ہوں میں","اس شعر میں شاعر اپنی ذاتی حالت کی تشریح کرتا ہے جہاں وہ اپنے اندرونی خلوص سے بے خبر ہے۔ شاعر اپنی پریشانی کا احساس دوسروں کے ذریعے سن کر کرتا ہے، جس سے یہ ظاہر ہوتا ہے کہ وہ اپنی مایوسی کو خود سمجھنے میں ناکام ہے۔ اس شعر کے اہم تصورات میں بے خودی، پریشانی اور خود شناسی کی کمی شامل ہیں۔

اس شعر کا مرکزی نکتہ یہ ہے کہ شاعر اپنی ذاتی حالت کا احساس نہیں کر سکتا اور اسے دوسروں کے ذریعے اپنی پریشانی کا پتہ چلتا ہے۔ یہ شعر انسانی نفسیات کی ایک عمیق سطح کو اجاگر کرتا ہے۔"
221,ساحر لدھیانوی,"تنگ آ چکے ہیں کشمکش_زندگی سے ہم
ٹھکرا نہ دیں جہاں کو کہیں بے_دلی سے ہم","اس شعر میں شاعر زندگی کی شدید مشکلات اور ان کے ساتھ جو جدوجہد کرنا پڑتا ہے، اس کا احساس ظاہر کرتا ہے۔ ""تنگ آ چکے ہیں کشمکش_زندگی سے ہم"" سے مراد یہ ہے کہ زندگی میں ہم بہت سی پریشانیوں اور مشکلات سے دوچار ہو چکے ہیں۔ ""ٹھکرا نہ دیں جہاں کو کہیں بے_دلی سے ہم"" سے مراد یہ ہے کہ ہمیں اپنی بے دلی کی وجہ سے اس دنیا کو ٹھکرا دینا نہیں چاہیے۔ شاعر یہ کہنا چاہتا ہے کہ زندگی کی مشکلات کے باوجود ہمیں دنیا کو ٹھکرانے کی بجائے صبر اور شجاعت سے کام لینا چاہیے۔"
222,گلزار,"شام سے آنکھ میں نمی سی ہے
آج پھر آپ کی کمی سی ہے",یہ شعر دو شخصیتوں کے درمیان گہری جذباتی اور عاطفی وابستگی کو ظاہر کرتا ہے۔ شاعر نے شام کے وقت سے آنکھوں میں نمی کا ذکر کرکے یہ بیان کیا ہے کہ کسی کی جدائی یا غیر موجودگی کی وجہ سے اندرونی افسردگی اور غم کی کیفیت پیدا ہو گئی ہے۔ اس شعر کا بنیادی مطلب یہ ہے کہ محبوب کی فراق کی صورت میں بھی شخص کی آنکھیں نم ہو جاتی ہیں، جس سے اندرونی اذیت اور دکھ کا احساس ہوتا ہے۔ یہ شعر گہری جذباتی وابستگی اور محبت کا اظہار ہے جو محبوب کی غیر موجودگی میں بھی محسوس ہوتی ہے۔
223,جاں نثار اختر,"یہ علم کا سودا یہ رسالے یہ کتابیں
اک شخص کی یادوں کو بھلانے کے لیے ہیں",اس شعر میں شاعر بیان کرتا ہے کہ علم کی دنیا میں کتابیں اور رسالے صرف ایک شخص کی یادوں کو بھلانے کے لیے ہیں۔ ظاہری مطلب سے یہ پتہ چلتا ہے کہ شاعر علم اور کتابوں کو انسانی یادوں سے بھی اہم تر تسلیم کرتا ہے۔ تاہم، گہری تشریح میں، یہ شعر ایک ایسے انسان کی تلاش کی عکاسی کرتا ہے جو علم کی دنیا میں ڈوب کر اپنی ذاتی یادوں اور احساسات کو بھولنا چاہتا ہے۔ یہ شعر محبت، نفرت، خوشی یا غم جیسی انسانی جذبات کو علم کی روشنی میں ڈھانپنے کی کوشش کا اظہار کرتا ہے۔ شاعر یہ بھی واضح کرتا ہے کہ علم اور کتابیں صرف عقلی تسکین فراہم کرتی ہیں، لیکن دلی تکلیفوں کو دور نہیں کر سکتیں۔
