,Poet_Name,Couplet,Interpretation
299,بشیر بدر,"پتھر مجھے کہتا ہے مرا چاہنے والا
میں موم ہوں اس نے مجھے چھو کر نہیں دیکھا",اِس شعر میں شاعر نے پتھر اور موم کے ذریعے اپنے محبوب کی بے رحمی اور بے پناہ سردی کا اِظہار کیا ہے۔ پتھر، جو سخت اور سرد ہے، شاعر کو یہ بتاتا ہے کہ شاعر کا محبوب اُس سے محبت کرتا ہے۔ لیکن شاعر خود کو موم سے تشبیہ دیتا ہے، جو بہت نازک اور پگھلنے والی چیز ہے۔ شاعر کہتا ہے کہ محبوب نے اُسے چھو کر بھی نہیں دیکھا، یعنی محبوب کی سردی نے شاعر کے محبت کے جذبات کو پگھلا دیا۔ اِس طرح، شعر میں عشق کی سردی اور اِس کے اَحساسات پر محبوب کی بے رحمی کا اِظہار ہے۔
300,داغؔ دہلوی,"عاشقی سے ملے_گا اے زاہد
بندگی سے خدا نہیں ملتا",اس شعر میں، شاعر کا ظاہری مطلب یہ ہے کہ عاشقی کے ذریعے خدا تک پہنچا جا سکتا ہے، جبکہ بندگی (عبادت و ریاضت) کے ذریعے نہیں۔ اس شعر میں عاشقی اور بندگی کے تصورات کا موازنہ کیا گیا ہے۔ عاشقی کو ایک طرح کی روحانی عبادت قرار دیا گیا ہے جو خدا تک پہنچانے کا سباب بنتی ہے، جبکہ بندگی کو صرف ایک ذاہری عمل قرار دیا گیا ہے جو خدا تک پہنچانے میں ناکام ہوتا ہے۔ شاعر کا اصل مقصد یہ ہے کہ خدا تک پہنچنے کے لیے دل کی صفائی اور عشق ضروری ہے، نہ کہ صرف ذاہری عبادت۔
301,جون ایلیا,"جان_لیوا تھیں خواہشیں ورنہ
وصل سے انتظار اچھا تھا","اس شعر میں شاعر اپنی خواہشات کی شدت اور ان کی تکمیل کے لیے اپنی جان کو قربان کرنے کے ارادے کا اظہار کرتا ہے۔ ""جان لیوا تھیں خواہشیں"" سے مراد یہ ہے کہ میری خواہشات اتنی شدید تھیں کہ میں ان کے لیے اپنی جان دے سکتا تھا۔ ""ورنہ وصل سے انتظار اچھا تھا"" سے شاعر ان خواہشات کی تکمیل کی جستجو میں اپنی جان کھونے کے بعد پچھتاتا ہے اور یہ سوچتا ہے کہ اگر میں وصال (ملاقات) کا انتظار کرتا تو یہ بہتر ہوتا۔ اس شعر میں اہم تصورات ""جان لیوا خواہشیں""، ""وصل"" اور ""انتظار"" ہیں، جو شاعر کی عاطفی کشمکش اور پچھتاوے کو بیان کرتے ہیں۔"
302,جون ایلیا,"اے شخص میں تیری جستجو سے
بے_زار نہیں ہوں تھک گیا ہوں","یہ شعر میں ایک انسان کی تلاش اور اس تلاش سے ہونے والی دھندلا پن کا اظہار کیا گیا ہے۔ ""اے شخص میں تیری جستجو سے بے_زار نہیں ہوں تھک گیا ہوں"" کے مطلب یہ ہیں کہ شاعر کسی شخص کی تلاش میں ہے اور اس تلاش سے تھک چکا ہے، لیکن بے زار نہیں ہوا ہے۔ یعنی شاعر کی تلاش ابھی بھی جاری ہے اور وہ حوصلہ نہیں ہارا ہے۔ اس شعر میں تلاش، تھکن، اور حوصلہ کے تصورات اہم ہیں۔ شاعر اپنی تلاش کا مقصد پورا کرنے کے لیے ابھی بھی مسلسل کوشش کر رہا ہے۔"
303,مرزا غالب,"موت کا ایک دن معین ہے
نیند کیوں رات بھر نہیں آتی","اس شعر میں شاعر انسانی زندگی کی پیچیدگی اور خوف موت کا احساس بیان کرتا ہے۔ ""موت کا ایک دن معین ہے"" سے مراد یہ ہے کہ ہر شخص کی موت ایک معین وقت پر ہونی ضروری ہے، جو انتہائی یقینی ہے۔ ""نیند کیوں رات بھر نہیں آتی"" سے مراد یہ ہے کہ موت کے خوف کی وجہ سے انسان کو نیند نہیں آتی، ممکنہ موت کے خوف نے اسے مستقل طور پر پریشان کر دیا ہے۔

شعر کا بنیادی تصور یہ ہے کہ انسانی زندگی کی عارضی نوعیت کا احساس اسے ہمیشہ پریشان رکھتا ہے۔ یہ شعر انسانی کمزوری اور اس کے باوجود زندگی کی اہمیت کو بھی اجاگر کرتا ہے، جس میں نیند کی عدم موجودگی ایک داخلی بے چینی اور اندرونی تناؤ کی عکاسی کرتی ہے۔"
304,پروین شاکر,"وہ نہ آئے_گا ہمیں معلوم تھا اس شام بھی
انتظار اس کا مگر کچھ سوچ کر کرتے رہے","اس شعر میں شاعر اپنی ناامیدی اور بے چینی کا احساس بیان کر رہا ہے۔ ""وہ نہ آئے گا"" سے شاعر کا یقین ظاہر ہوتا ہے کہ اس کا انتظار کردہ شخص نہیں آئے گا، لیکن پھر بھی وہ انتظار کرتا رہتا ہے، حالانکہ اسے یقین ہے کہ انتظار بے کار ہے۔ ""انتظار اس کا مگر کچھ سوچ کر کرتے رہے"" سے شاعر کی بے چینی اور اس کی کوشش ظاہر ہوتی ہے کہ وہ کسی نتیجے پر پہنچنے کی کوشش کر رہا ہے۔ یہ شعر ناامیدی اور بے چینی کے احساس کو بیان کرتا ہے۔"
305,قتیل شفائی,"آخری ہچکی ترے زانوں پہ آئے
موت بھی میں شاعرانہ چاہتا ہوں","یہ شعر زندگی کے اختتام پر موت کو ایک شاعرانہ انداز میں لے جانے کی خواہش کا اظہار کرتا ہے۔ ""آخری ہچکی"" سے مراد زندگی کی آخری سانس ہے، جبکہ ""ترے زانوں پہ آئے"" سے مراد یہ ہے کہ موت کے وقت بھی میں آپ کے قریب رہنا چاہتا ہوں۔ ""موت بھی میں شاعرانہ چاہتا ہوں"" سے مراد یہ ہے کہ موت کو بھی شاعری کی طرح شاندار اور خوبصورت بنانا چاہتا ہوں۔ اس شعر کا بنیادی مطلب یہ ہے کہ زندگی کے آخری لمحوں میں بھی شاعری کے جذبے کو برقرار رکھنا چاہتا ہوں۔"
306,مجروح سلطانپوری,"ایسے ہنس ہنس کے نہ دیکھا کرو سب کی جانب
لوگ ایسی ہی اداؤں پہ فدا ہوتے ہیں",اس شعر میں شاعر نے انسانی فطرت کی جانب اشارہ کیا ہے جہاں لوگ اکثر ظاہری اداؤں اور انداز سے فدا ہو جاتے ہیں۔ شاعر کہتا ہے کہ اگر کوئی شخص ہنس ہنس کر سبھی کی طرف دیکھتا ہے، تو لوگ اس کے اس انداز پر فدا ہو جاتے ہیں۔ یہ ایک اصل حقیقت کو ظاہر کرتا ہے کہ لوگ اکثر ظاہری انداز اور اداؤں سے زیادہ متاثر ہوتے ہیں بجائے اصل شخصیت کو سمجھنے کے۔ یہ شعر انسانی فطرت کی اس کمزوری کو بھی ظاہر کرتا ہے جہاں لوگ اکثر ظاہری انداز پر فدا ہو جاتے ہیں بجائے اصل کی جانب توجہ کرنے کے۔
307,جگر مراد آبادی,"تیری آنکھوں کا کچھ قصور نہیں
ہاں مجھی کو خراب ہونا تھا",یہ شعر ایک محبت کی داستان کی عکاسی کرتا ہے، جہاں شاعر اپنی محبوبہ کی آنکھوں کے قصور سے بے داغ کرتے ہوئے، اپنی حالت زار کا ذمہ دار خود کو قرار دیتا ہے۔ شعر کے ظاہری مطلب میں، شاعر کہتا ہے کہ اس کی محبوبہ کی آنکھوں کا کوئی قصور نہیں ہے، بلکہ اس کے خراب ہونے کا ذمہ دار وہی خود ہے۔ بنیادی تشریح میں، یہ شعر محبت کی بے بسی اور اس کے اثرات کو ظاہر کرتا ہے، جہاں شاعر اپنی محبوبہ کی خوبصورتی اور جلوہ گاہ کے قصور سے بے نیاز ہونے کی بجائے، اپنی حالت زار کا ذمہ دار خود کو ٹھہراتا ہے، جس سے اس کی محبت اور وفاداری کا اندازہ ہوتا ہے۔
308,علامہ اقبال,"حیا نہیں ہے زمانے کی آنکھ میں باقی
خدا کرے کہ جوانی تری رہے بے_داغ","اس شعر میں شاعر زمانے کی بے حیائی کا تذکرہ کرتا ہے۔ پہلی لائن میں، شاعر کہتا ہے کہ زمانے کی آنکھ میں حیا نہیں باقی رہی، یعنی دنیا میں حیا اور اخلاق کا تصور ختم ہو چکا ہے۔ دوسری لائن میں، شاعر دعا کرتا ہے کہ آپ کی جوانی داغ سے پاک رہے، یعنی آپ کی جوانی کو کسی بے حیائی یا غلط کام سے بچائے رکھا جائے۔

اس شعر کا بنیادی تشریح یہ ہے کہ دنیا میں اخلاقی اقدار کافی حد تک ختم ہو چکے ہیں، لیکن شاعر امید کرتا ہے کہ آپ کی جوانی ان اقدار کو برقرار رکھے گی۔ اہم تصورات میں حیا، زمانہ، جوانی، اور داغ شامل ہیں، جبکہ کلیدی نکات میں زمانے کی بے حیائی اور اخلاقی اقدار کی اہمیت شامل ہے۔"
309,نشور واحدی,"دیا خاموش ہے لیکن کسی کا دل تو جلتا ہے
چلے آؤ جہاں تک روشنی معلوم ہوتی ہے",اس شعر میں شاعر نے دیا کی خاموشی کا تذکرہ کرتے ہوئے ایک ایسے دل کی طرف اشارہ کیا ہے جو جل رہا ہے، مگر اس کا درد ظاہر نہیں ہوتا۔ اس کے بعد شاعر روشنی کی طرف بلاتا ہے، جو عموماً امید اور راہنمائی کی علامت ہے۔ اس شعر کا بنیادی مطلب یہ ہے کہ حالات کی سختیوں کے باوجود، انسان کو اپنے دل کی روشنی کی طرف بڑھنا چاہیے اور امید سے کام لینا چاہیے۔ اہم تصورات میں دیا، خاموشی، دل، جلنا، روشنی اور راہنمائی شامل ہیں۔
310,فیض احمد فیض,"نہ جانے کس لیے امیدوار بیٹھا ہوں
اک ایسی راہ پہ جو تیری رہ_گزر بھی نہیں",اس شعر میں شاعر اپنی بے چینی اور انتظار کی حالت کا اظہار کرتا ہے۔ ظاہری مطلب یہ ہے کہ شاعر کسی نہ معلوم امید کے انتظار میں بیٹھا ہے، حالانکہ اس راہ پر اس کا محبوب کبھی گزرا بھی نہیں۔ اس شعر کے بنیادی تصورات میں امید، انتظار، بے چینی اور راہ شامل ہیں۔ شاعر نے اس شعر میں انتظار کی بے چینی کو بڑے ہی خوبصورت انداز میں پیش کیا ہے۔ اس شعر سے یہ بات واضح ہوتی ہے کہ شاعر کسی ایسی راہ پر بیٹھا ہے جہاں اس کا محبوب کبھی نہیں گزرا، لیکن فی البدیہہ، وہ امیدوار ہے کہ شاید کبھی گزرے۔ اس طرح، شعر میں امید اور بے چینی کا ایک خوبصورت ملاپ نظر آتا ہے۔
311,احمد فراز,"قربتیں لاکھ خوبصورت ہوں
دوریوں میں بھی دل_کشی ہے ابھی","اس شعر میں شاعر نے قربت اور دوری کے تصورات کو بیان کیا ہے۔ ظاہری مطلب یہ ہے کہ ایک انسان کی زندگی میں قربتیں بہت خوبصورت ہوتی ہیں، لیکن دوریوں میں بھی دل کی کشی (دل کی آزادی) کا احساس ہوتا ہے۔ بنیادی تشریح یہ ہے کہ شاعر یہ بیان کرنا چاہتا ہے کہ قربتیں بہت خوشنما اور محبت بھری ہوتی ہیں، لیکن دوری بھی اپنی جگہ ایک خاص خوشی اور آزادی کا احساس دیتی ہے۔ یہ دوری کسی شخص کو اپنی ذاتی فضا میں رہنے کا موقع فراہم کرتی ہے اور اسے اپنی زندگی میں نئے تجربات اور احساسات کو جینے کا احساس دیتی ہے۔

اہم تصورات: قربت، دوری، دل کی کشی (آزادی)، خوبصورتی
کلیدی نکات: قربتیں خوبصورت ہوتی ہیں، دوریوں میں بھی دل کی کشی ہوتی ہے، دوری کی خوشی اور آزادی
الفاظ: قربتیں، لاکھ، خوبصورت، دوریوں، دل_کشی، ابھی"
312,بشیر بدر,"میں جب سو جاؤں ان آنکھوں پہ اپنے ہونٹ رکھ دینا
یقیں آ جائے_گا پلکوں تلے بھی دل دھڑکتا ہے",اس شعر میں شاعر اپنی محبوبہ کے لیے اپنی محبت کا اظہار کرتا ہے۔ شاعر کہتا ہے کہ جب وہ سو جائے تو اپنے ہونٹ اپنی محبوبہ کی آنکھوں پر رکھ دے گا، جس سے اسے یقین آ جائے گا کہ اس کا دل پلکوں تلے بھی دھڑکتا ہے۔ یہ شعر محبت، یقین اور دل کی دھڑکن کے تصورات کو بیان کرتا ہے۔
313,حفیظ جالندھری,"ارادے باندھتا ہوں سوچتا ہوں توڑ دیتا ہوں
کہیں ایسا نہ ہو جائے کہیں ایسا نہ ہو جائے","اس شعر میں شاعر اپنی غیر یقینی حالت زندگی کا اظہار کرتا ہے۔ وہ ارادے باندھتا ہے مگر ڈرتا ہے کہ کہیں ان کا انجام ناگوار نہ ہو جائے۔ شعر کے دو لفظوں ""ایسا نہ ہو جائے"" سے مراد کسی بری واقعہ یا ناکامی کا امکان ہے۔ شاعر اپنے ارادوں کی پوری نہیں کرنے کا ڈر ظاہر کرتا ہے، جو اس کی ذہنی بے چینی اور ناامیدی کی عکاسی کرتا ہے۔"
314,ندا فاضلی,"دنیا جسے کہتے ہیں جادو کا کھلونا ہے
مل جائے تو مٹی ہے کھو جائے تو سونا ہے",یہ شعر دنیا کی حقیقت اور اس کے اثرات کو بیان کرتا ہے۔ ظاہری مطلب یہ ہے کہ دنیا ایک جادو کا کھلونا ہے، جو ہمیں مل جائے تو مٹی کی طرح بے قیمت لگتی ہے، لیکن جب یہ ہم سے چھین لی جاتی ہے تو ہمیں اس کی قیمت اور اہمیت کا احساس ہوتا ہے اور وہ سونے کی طرح قیمتی لگتی ہے۔ بنیادی تشریح میں، اس شعر سے یہ پیغام ملتا ہے کہ دنیا کی چیزوں کو ہمیشہ قیمتی نہیں سمجھنا چاہیے، بلکہ ان کی اصل قدر تب سمجھ میں آتی ہے جب ہم انھیں کھو دیتے ہیں۔ یہ شعر انسانی زندگی کی عارضی قیمتوں اور ہمیشہ قابل تبدیلی حالات کی طرف اشارہ کرتا ہے۔
315,فراق گورکھپوری,"اب تو ان کی یاد بھی آتی نہیں
کتنی تنہا ہو گئیں تنہائیاں","اس شعر میں شاعر نے انسانی تجربے کی ایک اہم پہلو کو بیان کیا ہے: تنہائی اور یادوں کا احساس۔ ظاہری مطلب یہ ہے کہ شاعر کسی فرد کی یادوں کو بھول چکا ہے، لیکن اس کی وجہ سے تنہائی اور بھی گہری ہو گئی ہے۔ بنیادی تشریح میں، شعر میں دو اہم تصورات موجود ہیں: یادوں کا غائب ہونا اور تنہائی کا بڑھنا۔ یادوں کا غائب ہونا ایک طرح سے انسانی ذہن میں ایک خلا پیدا کرتا ہے، جس سے تنہائی کا احساس اور بڑھ جاتا ہے۔ شاعر کا مرکزی نقطہ نظر یہ ہے کہ تنہائی کی وجہ سے انسانی تجربے اور بھی زیادہ تنہا ہو جاتے ہیں، جس کی وجہ سے ذہنی صدمے اور بھی زیادہ ہوتے ہیں۔ شعر میں ""کتنی تنہا ہو گئیں تنہائیاں"" کا مطلب یہ ہے کہ تنہائی کی وجہ سے انسانی ذہن میں ایک سے زیادہ تنہائی کے احساس پیدا ہو جاتے ہیں، جس سے انسان اور بھی تنہا ہو جاتا ہے۔"
316,منیر نیازی,"جانتا ہوں ایک ایسے شخص کو میں بھی منیرؔ
غم سے پتھر ہو گیا لیکن کبھی رویا نہیں",یہ شعر میرزا اسد اللہ خان غالب کا ہے جو ایک بڑے اردو شاعر تھے۔ شعر میں شاعر ایک ایسے شخص کا تذکرہ کرتا ہے جسے وہ جانتا ہے: یہ شخص غم اور دکھ سے پتھر کی طرح سخت ہو گیا ہے، لیکن کبھی رویا نہیں۔ اس شخص کی سخت جمودی کیفیت کو پتھر کی طرح ظاہر کیا گیا ہے۔ شعر کا بنیادی مطلب یہ ہے کہ غم کی مرحلہ در مرحلہ بڑھتی ہوئی سختی کے باوجود، اس شخص نے اپنے دکھ کو ظاہر نہیں کیا۔ اس میں غم کی لگاتار تلخی اور اس کے نتیجے میں سخت جمودی کیفیت کا احساس ہے۔
317,جلیل مانک پوری,"یہ جو سر نیچے کئے بیٹھے ہیں
جان کتنوں کی لیے بیٹھے ہیں","اس شعر میں شاعر نے بڑی گہرائی سے انسانی زندگی کے اندرونی مسائل کو اجاگر کیا ہے۔ ""یہ جو سر نیچے کئے بیٹھے ہیں""، اس سے مراد وہ لوگ ہیں جو پریشانی اور ناامیدی کے ساتھ اپنے سر کو جھکائے ہوئے بیٹھے ہیں۔ ان کے سر نیچے ہونے کا مطلب ہے کہ وہ اپنی زندگی سے مایوس ہیں اور کوئی امید نہیں رکھتے۔

""جان کتنوں کی لیے بیٹھے ہیں""، اس سے شاعر یہ سوال اٹھاتا ہے کہ یہ لوگ کس کے لیے اپنی جان کو درہم برہم کر رہے ہیں؟ یعنی کس کی خوشنودی کے لیے یہ اپنے آپ کو تکلیف دے رہے ہیں؟ اس شعر میں انسانی زندگی کی پیچیدگیاں، اندرونی جدوجہد اور ناامیدی کی کیفیت بڑی ہی خوبصورتی سے بیان کی گئی ہے۔

اس شعر کا بنیادی مطلب یہ ہے کہ انسان اپنی زندگی میں کئی بار ایسے موقعوں سے دوچار ہوتا ہے جب وہ بے یقینی اور ناامیدی کا شکار ہو جاتا ہے۔ اس کی جان کس کے لیے ہے، اس سوال کے ذریعے شاعر نے زندگی کی حقیقی مقصد اور اس کی اہمیت پر روشنی ڈالی ہے۔"
318,فنا نظامی کانپوری,"ترے وعدوں پہ کہاں تک مرا دل فریب کھائے
کوئی ایسا کر بہانہ مری آس ٹوٹ جائے","اس شعر میں شاعر اپنے دل کی بے یقینی اور ناامیدی کا اظہار کر رہا ہے۔ شاعر کا دل ترے وعدوں پر فریب کھاتا رہا ہے، جس سے اسے بڑی تکلیف ہوتی ہے۔ شاعر چاہتا ہے کہ کوئی ایسا بہانہ پیدا ہو جائے جس سے اس کی آس ٹوٹ جائے اور وہ اس ناامیدی سے نجات پا سکے۔ اس شعر میں اہم تصورات ""وعدے""، ""فریب""، ""آس"" اور ""بہانہ"" شامل ہیں، جو شاعر کی دلی حالت کو بیان کرتے ہیں۔"
319,عباس تابش,"یہ محبت کی کہانی نہیں مرتی لیکن
لوگ کردار نبھاتے ہوئے مر جاتے ہیں",اس شعر میں شاعر نے ایک اہم روحانی حقیقت کو ظاہر کیا ہے کہ زندگی میں ہر وقت خوشی میں ہنسنا اور تنہائی کے لمحوں میں رونا دونوں ضروری ہیں۔ ہر وقت ہنسنا انسان کو ظاہری طور پر برباد کر سکتا ہے کیونکہ یہ اس کی احساسات کو دبا دیتا ہے۔ تنہائی کے لمحوں میں رونا انسان کے لیے ایک علاج ہے جس سے وہ اپنی اندرونی تکلیف کو بیان کر سکتا ہے اور اسے تسکین حاصل ہو سکتی ہے۔ اس طرح، اس شعر میں خوشی اور غم کی ایک توازن کی ضرورت کو اجاگر کیا گیا ہے۔
320,محسن نقوی,"ہر وقت کا ہنسنا تجھے برباد نہ کر دے
تنہائی کے لمحوں میں کبھی رو بھی لیا کر",یہ شعر ایک انسان کی بے چینی اور تنہائی کا اظہار کرتا ہے۔ شاعر کہتا ہے کہ وہ عادت ڈال چکا ہے روٹھ جانے کی (اپنی ناراضی کا اظہار کرنے کی)۔ اس کے بعد، شاعر اپنے محبوب سے درخواست کرتا ہے کہ وہ اسے منا لیا کرے، یعنی اس کی ناراضی دور کرے اور اسے فروغ دے۔ اس شعر میں ایک گہری جذباتی خواہش واضح ہوتی ہے جس میں شاعر اپنے محبوب سے محبت اور توجہ کی تلاش کرتا ہے۔ یہ شعر انسانی تعلقات کی نازکی اور محبت کی اہمیت کو بھی اجاگر کرتا ہے۔
321,جون ایلیا,"مجھ کو عادت ہے روٹھ جانے کی
آپ مجھ کو منا لیا کیجے",یہ شعر عاشقی کی من مانی خیالات اور خوابوں کے حقیقت سے دور ہونے کی طرف اشارہ کرتا ہے۔ میر کا مطلب ہے کہ اگر کوئی شخص عاشقی میں خواب دیکھنے لگے تو وہ حقیقت سے بھٹک جائے گا اور باؤلے (پاگل) ہو جائے گا، کیونکہ عاشقی کے خواب مہتاب (چاند) کی طرح سراسر دھوکا ہوتے ہیں۔ اس شعر میں عاشقی کی جانفزا خیالات اور ان کے نتائج پر توجہ دی گئی ہے، جس کی وجہ سے انسان حقیقت سے کٹ کر ایک خیالی دنیا میں گم ہو جاتا ہے۔
322,احمد فراز,"عاشقی میں میرؔ جیسے خواب مت دیکھا کرو
باؤلے ہو جاؤ_گے مہتاب مت دیکھا کرو",اس شعر میں شاعر نے ایک رومانوی ماحول کی تصویر کشی کی ہے جہاں شب وصال (ملاپ کی رات) کا تصور پیش کیا گیا ہے۔ شاعر کہتا ہے کہ گل کر دو ان چراغوں کو، کیونکہ جلنے والوں کی خوشی کی بزم میں ان کا کوئی کام نہیں۔ اس شعر میں خوشی اور افسردگی کے تصادم کو بیان کیا گیا ہے، جہاں چراغوں کا جلنا ایک طرف خوشی کی علامت ہے لیکن دوسری طرف جلنے والے لوگوں کی کیفیت کو بھی اجاگر کرتا ہے۔ شاعر کا یہ مطلب ہے کہ خوشی کے لمحات میں جلنے والوں کی ضرورت نہیں ہوتی۔
323,داغؔ دہلوی,"شب_وصال ہے گل کر دو ان چراغوں کو
خوشی کی بزم میں کیا کام جلنے والوں کا","یہ شعر دوستی اور احساسات کے موضوع پر لکھا گیا ہے۔ ظاہری مطلب یہ ہے کہ شاعر کسی دوست سے کہہ رہا ہے کہ وہ صرف اس کی باتیں سنانے کے لیے آیا ہے اور دوست بھی صرف اپنے دل کے دکھ دکھانے کے لیے آیا ہے۔

تشریح میں، اہم تصورات یہ ہیں کہ دوستی میں بات چیت اور احساسات کا اشتراک بہت ضروری ہے۔ شاعر یہ بھی بتاتا ہے کہ دوست اپنے دل کے دکھ اور احساسات کو دوسرے کے سامنے کھول کر رکھتا ہے، جس سے دوستی کی قدر اور اہمیت ظاہر ہوتی ہے۔ یہ شعر دوستی کی پاکیزگی اور اکھٹیت کو بھی اجاگر کرتا ہے۔"
324,احمد فراز,"تیری باتیں ہی سنانے آئے
دوست بھی دل ہی دکھانے آئے",اس شعر میں شاعر نے دو بنیادی تصورات پیش کیے ہیں: ایک تو لوگوں کی رائے کی ساریت اور دوسرا خدا کی ناگزیر حقیقت۔ شعر کا مطلب یہ ہے کہ لوگ ایسی چیزوں کو برا کہتے ہیں جو ان کے سامنے ہوتی ہیں، لیکن ایسی چیزوں کو خدا کہتے ہیں جنہیں انھوں نے دیکھا ہی نہیں۔ یہ شعر انسانی نقطہ نظر کی سستی اور خدا کی عظمت کو بیان کرتا ہے۔ شاعر کے نزدیک، لوگوں کی رائے کی بنیاد محدود تجربات پر ہوتی ہے، جبکہ خدا کی حقیقت ایسی ہے جسے کسی نے دیکھا ہی نہیں لیکن اس پر یقین رکھتا ہے۔ یہ شعر انسانی فکر کی سطحیت اور خدا کی نامعلوم حقیقت کے درمیان موجود فرق کو اجاگر کرتا ہے۔
